,date,username,Steaming,label
633,2022-03-22 08:46:22+00:00,mainmainid_,studi omicron tahan muka benda omicron corona covid,negative
634,2022-03-21 09:45:34+00:00,lensaRTV,data sebar covid19 indonesia 21 maret 2022 jawa barat wilayah catat tambah tinggi yuk sayabisadisiplinprotokolcovid19 updatecovid19 positifcovid19 omicron omicronindonesia varianomicron jawabarat jakarta jawatengah,negative
635,2022-03-21 04:57:23+00:00,beritaKBR,varian omicron ba2 menteri sehat tengah awas kembang deltacron varian sarscov omicron deltacron covid19,negative
636,2022-03-20 13:16:45+00:00,dharasyah,lahhh kirain corona udah bener hilang tau adi covidisnotover omicron deltacron,negative
637,2022-03-20 09:25:44+00:00,lensaRTV,data sebar covid19 indonesia 20 maret 2022 jakarta wilayah catat tambah tinggi yuk sayabisadisiplinprotokolcovid19 updatecovid19 positifcovid19 omicron omicronindonesia varianomicron jawabarat jakarta jawatengah,negative
638,2022-03-20 01:32:49+00:00,aus_forum,3833 cases of covid 19 in china jilin 1494 hebei 555 shanghai 509 shandong 431 fujian 267 liaoning 171 guangdong 78 covid19 china omicron ba2,negative
639,2022-03-19 09:19:03+00:00,lensaRTV,data sebar covid19 indonesia 19 maret 2022 jawa barat wilayah catat tambah tinggi yuk sayabisadisiplinprotokolcovid19 updatecovid19 positifcovid19 omicron omicronindonesia varianomicron jawabarat jakarta jawatengah,negative
640,2022-03-18 17:06:20+00:00,maspalomas24h,casos de covid19 en canarias covid coronavirus omicron islascanarias,negative
641,2022-03-18 16:53:53+00:00,MasEventoscom,casos de covid19 en canarias covid coronavirus omicron islascanarias,negative
642,2022-03-18 12:04:25+00:00,IDbelasting,hari covid19 indonesia tambah 9528 omicron covid19 kasusharian pandemi satgascovid,negative
643,2022-03-18 10:37:19+00:00,lensaRTV,data sebar covid19 indonesia 18 maret 2022 jawa barat wilayah catat tambah tinggi yuk sayabisadisiplinprotokolcovid19 updatecovid19 positifcovid19 omicron omicronindonesia varianomicron jawabarat jakarta jawatengah,negative
644,2022-03-18 02:21:03+00:00,jpnncom,dwi oktavia 1477 tinggal periode covid19 varian omicron omicron,negative
645,2022-03-18 01:46:56+00:00,meehawl,ba2 omicron bugaloo,negative
646,2022-03-17 10:33:14+00:00,bharianmy,bhdunia rekod tinggi pandemik dorong varian omicron omicron coronavirus covid19,negative
647,2022-03-17 09:30:04+00:00,lensaRTV,data sebar covid19 indonesia 17 maret 2022 jawa barat wilayah catat tambah tinggi yuk sayabisadisiplinprotokolcovid19 updatecovid19 positifcovid19 omicron omicronindonesia varianomicron jawabarat jakarta jawatengah,negative
648,2022-03-17 07:04:46+00:00,shajar__02__,jldi aa bhai tera hi intezar tha bs cancel kra jldi exam omicron,negative
649,2022-03-16 10:27:15+00:00,bharianmy,bhdunia tingkat dadak tara akibat gelombang omicron coronavirus covid19 omicron,negative
650,2022-03-16 09:22:50+00:00,lensaRTV,data sebar covid19 indonesia 16 maret 2022 jawa barat wilayah catat tambah tinggi yuk sayabisadisiplinprotokolcovid19 updatecovid19 positifcovid19 omicron omicronindonesia varianomicron jawabarat jakarta jawatengah,negative
651,2022-03-16 07:52:23+00:00,thekops_711,lepas 2 tauntumbang jugak sbb coviddamn omicron,negative
652,2022-03-16 05:39:00+00:00,newsmerahputih,varian omicron warga heboh varian anak omicron merahputihcom anakomicron omicron,negative
653,2022-03-16 03:29:39+00:00,tribunmedan,mutasi covid19 gejala deltacron covid19 mutasi kombinasi omicron delta waspada gejaladeltacron gelajacovid gejalaomicron via tribunmedan,negative
654,2022-03-16 01:39:41+00:00,aus_forum,3054 local cases of covid 19 in mainland china today jilin 1853 hebei 277 shanghai 202 shandong 180 guangdong 113 tianjin 68 jiangsu 61 covid19 omicron china chinalockdown,negative
655,2022-03-15 10:01:28+00:00,lensaRTV,data sebar covid19 indonesia 15 maret 2022 jawa barat wilayah catat tambah tinggi yuk sayabisadisiplinprotokolcovid19 updatecovid19 positifcovid19 omicron omicronindonesia varianomicron jawabarat jakarta jawatengah,negative
656,2022-03-15 08:20:27+00:00,hazanzan2,418pm omicron punah deltacron hasil kawen silang delta omicron deltacron punah variant ini covid sop,negative
657,2022-03-15 03:30:28+00:00,kompascom,menteri sehat budi gunadi sadikin mati akibat covid19 hong kong tingkat gelombang omicron cakup vaksinasi dosis lansia rendah 26 persen gt omicron hongkong jernihkanharapan,negative
658,2022-03-15 02:08:37+00:00,pedomanTNG,omicron muncul varian deltacron omicron deltacron,negative
659,2022-03-14 16:30:00+00:00,voaindonesia,wenang china senin 143 lapor 1337 covid19 tular lokal puluh kota china hari besar tahun pakar picu omicron siluman,negative
660,2022-03-14 15:08:32+00:00,akutahu,tahu sobat muncul varian covid19 deltacron nama deltacron varian rekombinasi varian delta omicron gejala bahaya varian deltacron delta omicron covid19 pandemi,negative
661,2022-03-14 12:10:13+00:00,murianewscom,menkes omicron siluman dominasi indonesia lengkap klik taut jakarta menkes omicron indonesia,negative
662,2022-03-14 09:33:57+00:00,BdgBergerakID,hasil lolos gelombang varian delta tahun hadap gelombang omicron covid19 omicron deltacron karenabandungpenting bandungbergerak,negative
663,2022-03-14 09:32:25+00:00,lensaRTV,data sebar covid19 indonesia 14 maret 2022 jawa barat wilayah catat tambah tinggi yuk sayabisadisiplinprotokolcovid19 updatecovid19 positifcovid19 omicron omicronindonesia varianomicron jawabarat jakarta jawatengah,negative
664,2022-03-14 03:52:20+00:00,pikiran_rakyat,china karantina besarbesaran kota covid19 varian omicron karantina covid19 omicron china varian via youtube,negative
665,2022-03-13 23:10:43+00:00,kamarulbahrin,omicron demam selsema ringan populasi yg vaksin bawa mati,negative
666,2022-03-13 13:20:12+00:00,HeraldSelatan,deltacron mutasi virus gabung deltaomicron covid19 deltacorn omicron,negative
667,2022-03-13 09:23:47+00:00,lensaRTV,data sebar covid19 indonesia 13 maret 2022 jawa barat wilayah catat tambah tinggi yuk sayabisadisiplinprotokolcovid19 updatecovid19 positifcovid19 omicron omicronindonesia varianomicron jawabarat jakarta jawatengah,negative
668,2022-03-13 08:54:02+00:00,onenewsmalaysia,omicron angka kes covid19 korea selatan tinggi onenews omicron,negative
669,2022-03-13 05:27:10+00:00,themiraqi,joints dah sakit extra sakit covid19 omicron,negative
670,2022-03-13 03:07:17+00:00,jalahoaks,pesawat semprot cair sebab demam sakit tenggorok informasi 100 hoaks lengkap hoaks jalahoaks pesawat omicron covid19,negative
671,2022-03-12 09:57:06+00:00,lensaRTV,data sebar covid19 indonesia 12 maret 2022 jawa barat wilayah catat tambah tinggi yuk sayabisadisiplinprotokolcovid19 updatecovid19 positifcovid19 omicron omicronindonesia varianomicron jawabarat jakarta jawatengah,negative
672,2022-03-11 23:18:27+00:00,TheUncleDee,msaiddidu luhut binsar panjaitan bahaya covid19 ganas omicron kepala gerogot negara kemarin main samar samar dg terang terang yg difirkan perut anggap negara waris bapak,negative
673,2022-03-11 10:54:09+00:00,redaksisuma,aktif covid19 pulau riau 10 maret 2022 varian omicron catat 2846 omicron omicronvirus covid19 omikron sumaid,negative
674,2022-03-11 10:32:11+00:00,lensaRTV,data sebar covid19 indonesia 11 maret 2022 jawa barat wilayah catat tambah tinggi yuk sayabisadisiplinprotokolcovid19 updatecovid19 positifcovid19 omicron omicronindonesia varianomicron jawabarat jakarta jawatengah,negative
675,2022-03-11 09:35:29+00:00,missqwueen,long covid pasca omicron mual sulit tidur mudah lelah kepala ringan pingsan tahan hplaptop,negative
676,2022-03-10 16:40:52+00:00,riosiokona,gua ga cerita temen temen bantu rt rsud kota bekas om gua doang tutup gatau rsudkotabekasi athread threadcovid kotabekasi omicron nganternyawadoang,negative
677,2022-03-10 09:55:05+00:00,lensaRTV,data sebar covid19 indonesia 10 maret 2022 jawa barat wilayah catat tambah tinggi yuk sayabisadisiplinprotokolcovid19 updatecovid19 positifcovid19 omicron omicronindonesia varianomicron jawabarat jakarta jawatengah,negative
678,2022-03-10 09:17:47+00:00,witdap,isoman 7 batuk udah jarang tp batuk ken muntah perit perih begah mual basmallah cepet sembuh covid19 berasavip omicron aremaday arap,negative
679,2022-03-10 06:16:10+00:00,tonyjoseon,kemendag jokowi kiyaimarufamin minyakgoreng normal next milu kah org antri beli minyakgorenglangka jaman pandemi gin takut si omicron cepet tular,negative
680,2022-03-10 01:01:04+00:00,kitajiran,dengar omicron ni biak bahagian salur nafas manusia patut mudah jangkit vaksin cepatcepat dapat temu janji vaksin okaybukan je lindung lindung jiran kitajiran covid19 omicron,negative
681,2022-03-09 23:00:01+00:00,KompasKlasika,indonesia nilai lewat puncak gelombang omicron waspada mati tinggi longgar mobilitas pulih ekonomi ikut terap protokol sehat omicron,negative
682,2022-03-09 22:47:14+00:00,_nupi_,rasane koyo pancingen nek iki omicron,negative
683,2022-03-09 22:08:58+00:00,SaptaSahasrani,perhati data hongkong cermat hatihati bijak ambil indonesia benarbenar final ambil jalan invasif longgar protokol sehat varian omicron,negative
684,2022-03-09 17:24:32+00:00,wellylie99,covid19 pandemi omicron trending polusiudara jgn minum vitamin banyak krn bahaya lebih vitamin lbh bahaya dr kurang vitamin dlm tubuh paham yaa fix sih racun vitamin coyy,negative
685,2022-03-09 16:47:00+00:00,newsmerahputih,hoaks fakta perintah tutup masjid ramadan 2022 anjur organisasi sehat dunia who cegah varian covid19 omicron merahputihcom covid19 omicron,negative
686,2022-03-09 11:21:37+00:00,PMI_DKI_Jakarta,omicron iring jalan waktu varian covid 19 kembang varian omicron sih omicron yuk mari simak informasi covid19 omicron pmiselalubantu,negative
687,2022-03-09 10:53:51+00:00,NDemensia,sore kondisi recovery covid19 orangorang butuh 7 omicron gw udah 14 hari masiiih aja lemes,negative
688,2022-03-09 09:40:10+00:00,lensaRTV,data sebar covid19 indonesia 9 maret 2022 jawa barat wilayah catat tambah tinggi yuk sayabisadisiplinprotokolcovid19 updatecovid19 positifcovid19 omicron omicronindonesia varianomicron jawabarat jakarta jawatengah,negative
689,2022-03-08 22:32:39+00:00,JaPenWPKL,penting dos galak vaksin covid19 tri nilai kendiri covid19 kempen putus rantai covid19 keluarga malaysia lari maya keluarga malaysia iow komunikasikita omicron tri keluargamalaysia lindungdirilindungsemua,negative
690,2022-03-08 21:23:28+00:00,muelpontoh,commuterline hi minmau nanya pembatasanfisical distansing tumpang duduk bangku prioritas tanda tanda tdk dilepasagar jalan protocol sehat covid19 omicron,negative
691,2022-03-08 15:07:43+00:00,santi_widawati,tingkat korban si covid sdh 150831 nyawa rakyat indonesia layang ambil si covid19 umur tdk yg tau umur tangan allah manusia ingat2 pesan mati coronavirus omicron corona,negative
692,2022-03-08 13:18:02+00:00,jpnncom,juru bicara vaksinasi covid19 kemenkes siti nadia tarmizi data baru kait mati akibat omicron omicron,negative
693,2022-03-08 10:54:39+00:00,santridanalam,mortality 7 maret trend kecuali dki banten bal covid19 indonesia omicron,negative
694,2022-03-08 10:33:09+00:00,pikiran_rakyat,update covid19 indonesia 8 maret 2022 angka sembuh tingkat 55128 hari update pasien positif tinggal dunia sembuh perintah virus corona omicron delta covid19 indonesia prmn pikiranrakyat,negative
695,2022-03-08 10:32:45+00:00,lensaRTV,data sebar covid19 indonesia 8 maret 2022 jawa barat wilayah catat tambah tinggi yuk sayabisadisiplinprotokolcovid19 updatecovid19 positifcovid19 omicron omicronindonesia varianomicron jawabarat jakarta jawatimur,negative
696,2022-03-08 01:13:21+00:00,add_addam,lambat laun generasi influenza tau covid omicron omicron,negative
697,2022-03-07 19:11:22+00:00,mainmainid_,muncul subvarian omicron ba3 sebab sakit parah omicron coronavirus coronaupdate,negative
698,2022-03-07 14:19:43+00:00,detikcom,batuk salah gejala kerap temu covid19 varian omicron beda batuk gejala omicron cnnindonesia detiknetwork,negative
699,2022-03-07 13:02:23+00:00,LaporCovid,bawa virus tambah varian omicron infeksius regulasi syarat jalan domestik bijak kaji ulang,negative
700,2022-03-07 13:02:22+00:00,LaporCovid,individu vaksin lengkap risiko infeksi alami buru gejala mati ratus catat tinggal dunia tengah gelombang omicron,negative
701,2022-03-07 11:28:01+00:00,ikadeepika,nak malam gatal tekak tu nak bincang bersin 2 5 nak lemah badan nampaknya level vampire aktif malam covid19 omicron day3,negative
702,2022-03-07 10:58:20+00:00,pikiran_rakyat,update covid19 indonesia 7 maret 2022 angka sembuh tingkat 48800 hari update pasien positif tinggal dunia sembuh perintah virus corona omicron delta covid19 indonesia prmn pikiranrakyat,negative
703,2022-03-07 10:58:02+00:00,lensaRTV,data sebar covid19 indonesia 7 maret 2022 jawa barat wilayah catat tambah tinggi yuk sayabisadisiplinprotokolcovid19 updatecovid19 positifcovid19 omicron omicronindonesia varianomicron jawabarat jakarta jawatimur,negative
704,2022-03-07 10:31:17+00:00,dw_indonesia,negaranegara pulau pencil pasifik gulat mati dorong varian omicron tular hong kong alami lonjak korban tinggal ketat upaya rang virus strategi nolcovid cina 2,negative
705,2022-03-07 10:25:04+00:00,Beritabaruco,bising atur bising toa aturantoa gusdur mbakhruthohir menteriagama omicron,negative
706,2022-03-07 09:49:51+00:00,beritaKBR,varian sulit deteksi tes pcr sgtf sgene target failure metode identifikasi varian omicron omicron covid19,negative
707,2022-03-07 08:49:57+00:00,cutsarah,update vaksinasi covid19 indonesia cakup sdm sehat tugas publik lansia masyarakat umum amp rentan remaja omicron covidvaccine vaksin indonesiasehatindonesiahebat,negative
708,2022-03-07 08:15:23+00:00,aieorkeska,lega demam batuk sakit badan hilang tido makan tido tengok fon je day 3 omicron,negative
709,2022-03-07 07:32:57+00:00,Beritasatu,subvarian omicron baru ba3 yakin sebar cepat rendah sebab baca lengkap,negative
710,2022-03-07 07:09:14+00:00,Beritasatu,kunjung habis muncul subvarian omicron baru ba3 baca lengkap,negative
711,2022-03-07 05:58:36+00:00,fajaronline,who umum cucu baru omicron iwan fals buset dah cicit ponakan tante iwanfals omicron who,negative
712,2022-03-06 21:07:27+00:00,MediakomKemkes,omicron indonesia covid peristiwa,negative
713,2022-03-06 15:00:18+00:00,rizal_ninodeale,son of omicron temu yogyakarta sonofomicron omicron covid19 covidisnotover yogyakarta kemenkes vaksinbooster vaksinasi vaccinated,negative
714,2022-03-06 14:01:08+00:00,wilsontherik,mahasiswa bimbing semangat selesai skripsi eee wa hasil anti gen positif covid19 isoman pesan utama fokus pulih sembuh anggap remeh covid19 omicron,negative
715,2022-03-06 13:55:26+00:00,witdap,isoman 3 keluh hidung buntu batuk badan kadang meriang nafsu makan oke alhamdulilmah moga besok semakib baik omicron covid,negative
716,2022-03-06 11:38:00+00:00,aieorkeska,batuk demam lesu ape xjadi makan ubat tido makan makan ubat repeat day 2 omicron,negative
717,2022-03-06 09:49:14+00:00,lensaRTV,data sebar covid19 indonesia 6 maret 2022 jawa barat wilayah catat tambah tinggi yuk sayabisadisiplinprotokolcovid19 updatecovid19 positifcovid19 omicron omicronindonesia varianomicron jawabarat jakarta jawatengah,negative
718,2022-03-06 09:42:32+00:00,serambinews,updatecoronalhokseumawe omicron protokolkesehatan terap protokol sehat masker rumah cuci tangan sabun sering jaga jarak,negative
719,2022-03-06 09:30:01+00:00,Genpi_Co,epidemiolog griffith university australia dicky budiman pesan kait ancam covid19 varian omicron ba2 omicron,negative
720,2022-03-06 06:37:45+00:00,Beritasatu,omicron tingkat kalang ajar kota qingdao tiongkok baca lengkap,negative
721,2022-03-06 02:30:39+00:00,kamarulbahrin,varian zuriat lineage omicron covid19 scicomm,negative
722,2022-03-06 01:51:26+00:00,Muschelschloss,neue omikronvariante ba2i1221t in hongkong omicron corona,negative
723,2022-03-05 10:50:06+00:00,lensaRTV,data sebar covid19 indonesia 5 maret 2022 jawa barat wilayah catat tambah tinggi yuk sayabisadisiplinprotokolcovid19 updatecovid19 positifcovid19 omicron omicronindonesia varianomicron jawabarat jakarta jawatimur,negative
724,2022-03-05 09:46:00+00:00,syawal,lilyzali yg baru hari protocol kkm uji hari gunapakai mula gelombang omicron shj selang hari 7 skrg ms kuarantin boosted pendek bekal testkit sukar dapat,negative
725,2022-03-05 09:33:43+00:00,syawal,lilyzali elak false ve amp sahkan jangkit amp nk kuarantin negara self test sblm waktu virus load peak berbeza delta amp omicron saring hari amp stok testkit,negative
726,2022-03-05 07:26:36+00:00,nisya_ratnasari,part 1 iya covid kali cuman ambil sisi positif aja gt emang butuh istirahat libur rutinitas oke tau hasil notifikasi plindungiapp dapet hasil laboratorium covidlagi omicron,negative
727,2022-03-05 05:41:18+00:00,OP_Lamba,isoman omicron covid19,negative
728,2022-03-05 04:36:45+00:00,rspantinirmala,konfirmasi positif covid19 varian omicron waktu rentan tular omicron virusomicron covid19 viruscovid varianomicron,negative
729,2022-03-05 03:48:32+00:00,rohmahsg,selamat balita tanggung omicron pandemicovid19 gelombangketiga kesehatanbalita vaksinbooster,negative
730,2022-03-05 02:05:34+00:00,kompascom,omicron siluman sebut subvarian omicron ba2 asal garis turun varian omicron omicron wiken,negative
731,2022-03-05 01:12:44+00:00,kompascom,son of omicron temu yogyakarta perintah diy sulit cegah kerumun covid19 yogyakarta omicron,negative
732,2022-03-04 21:54:43+00:00,Rensi18798704,virus jantan covid19 omicron,negative
733,2022-03-04 20:22:02+00:00,jpnncom,varian omicron sebab lonjak covid19 signifikan februari 2022 omicron,negative
734,2022-03-04 12:43:06+00:00,sirdisc,sakit pinggang simptom omicron,negative
735,2022-03-04 11:39:32+00:00,syawal,tdanial93 rinnsyazana risiko jangkit kes hospital kes icu kes mati ramai dpt booster byk faedah atas omicron delta pakai uniform xnpk 2 dose primer susut dgn booster,negative
736,2022-03-04 10:30:52+00:00,lensaRTV,data sebar covid19 indonesia 4 maret 2022 jawa barat wilayah catat tambah tinggi yuk sayabisadisiplinprotokolcovid19 updatecovid19 positifcovid19 omicron omicronindonesia varianomicron jawabarat jakarta jawatimur,negative
737,2022-03-04 09:02:43+00:00,aalsya,senggol omicron yg berat 3 omicron aliaefcom,negative
738,2022-03-04 07:59:00+00:00,kompascom,juru bicara vaksinasi covid19 kemenkes dr siti nadia tarmizi mepid omicron siluman cepat tular omicron,negative
739,2022-03-04 06:19:37+00:00,karinayara,ngerasain minum obat vit 1000 vit d3 1000 obat batuk obat radang obat demam covidsucks omicron,negative
740,2022-03-04 05:58:09+00:00,tribunmedan,beda gejala omicron virus cenderung tenggorok delta paru waspada via tribunmedan,negative
741,2022-03-04 04:30:00+00:00,newsmerahputih,hoaks fakta konsumsi kopi pahit atas varian omicron merahputihcom omicron kopi varian,negative
742,2022-03-04 04:24:13+00:00,RadioElshinta,puncak hari covid19 varian omicron indonesia prediksi februari maret waspada panik taat prokes upaya ampuh hindar omicron,negative
743,2022-03-04 04:03:03+00:00,satukanalcom,son of omicron indonesia tambah 332 nasional total salah varian sarscov2 b11529 omicron ba2 baca lengkap covid19 kanalstraight kasu kimlahkasus sonofomicron,negative
744,2022-03-04 02:56:40+00:00,zunarkartunis,fakta kartun soal khairykj amp ismailsabri60 pcr test indonesia harga siling bayar mahal kj ismailsabri covid omicron,negative
745,2022-03-03 12:54:46+00:00,TitikTerangNews,252 omicron siluman deteksi indonesia,negative
746,2022-03-03 11:17:02+00:00,oziehealth,msaiddidu chef salimozddsyamlanos udah cobain flu covid omicron chef rasa flu covid omicron penasaran,negative
747,2022-03-03 10:44:02+00:00,lensaRTV,data sebar covid19 indonesia 3 maret 2022 jawa barat wilayah catat tambah tinggi yuk sayabisadisiplinprotokolcovid19 updatecovid19 positifcovid19 omicron omicronindonesia varianomicron jawabarat jakarta jawatimur,negative
748,2022-03-03 10:40:02+00:00,jpnncom,covid19 subvarian omicron deteksi diy februari cepat tular tingkat parah tinggi omicron,negative
749,2022-03-03 07:05:25+00:00,Jasskhuzairi,skrg ni manusia golong je 1 positive 2 close contact 3 casual contact semuga virus lenyap amin covid19 endemikcovid endemik omicron,negative
750,2022-03-03 04:46:03+00:00,serambinews,omicron gejala sehat pasien rasa tenggorok gatal sakit tenggorok,negative
751,2022-03-03 03:28:01+00:00,serambinews,kasuscovid19 omicron sehat pasien omicron keluh gejala demam sakit kepala nyeri tubuh batuk sakit tenggorok,negative
752,2022-03-03 03:21:19+00:00,LikyLed,covid19 kota kupang sdh tembus dr 3000 aktif 10 lipat dr 2 minggu rekor tinggi 2020 covid19 kotakupang omicron,negative
753,2022-03-03 03:03:52+00:00,mahbub_haz,mantaaap covid19 omicron,negative
754,2022-03-03 02:46:01+00:00,siDanar,liat laman berita yg 3 tinggal gegara covid19 omicron si balita nggak kasi coba klo ttp nggak prokes,negative
755,2022-03-03 00:52:56+00:00,Gracia30392777,hirup omicron omicron omicronvarient coronavirus coronavirusupdates,negative
756,2022-03-02 23:50:45+00:00,dindader,yg covid susu covid19 omicron,negative
757,2022-03-02 13:13:02+00:00,pikiran_rakyat,ratus omicron siluman ba 2 deteksi indonesia waspada gejala omicron siluman omicronba2 indonesia via youtube,negative
758,2022-03-02 12:18:30+00:00,RADARSOLO_,iring tingkat angka sebar korban tinggal akibat covid19 badan tanggulang bencana daerah bpbd kabupaten karanganyar gandeng rawan pemulasaran jenazah covid19 covid19 omicron,negative
759,2022-03-02 11:04:51+00:00,IDbelasting,kemenkes deteksi 252 varian mutasi omicron indonesia omicron varianomicron covid kemenkes,negative
760,2022-03-02 10:43:39+00:00,lensaRTV,data sebar covid19 indonesia 2 maret 2022 jawa barat wilayah catat tambah tinggi yuk sayabisadisiplinprotokolcovid19 updatecovid19 positifcovid19 omicron omicronindonesia varianomicron jawabarat jakarta jawatimur,negative
761,2022-03-02 06:30:40+00:00,kumparanMOM,catat aktif alami turun 19200 573898 282 554698 13 kemarin simak lengkap link kumparanmom momsupdate covid19 omicron,negative
762,2022-03-02 06:10:47+00:00,IDbelasting,teliti baru vaksin pfizer ampuh lindung anak omicron omicron pfizer vaksin vaksinasi anak covid,negative
763,2022-03-02 05:01:00+00:00,newsmerahputih,menteri sehat ri deteksi 252 ba2 varian mutasi covid19 omicron indonesia merahputihcom covid19 omicron,negative
764,2022-03-02 04:34:23+00:00,rezalisni,omicron yg qadarullah kena omicron positif swap antigen gejala tenggorok perih batuk radang tenggorok kepala sakit badan meriang,negative
765,2022-03-02 03:48:20+00:00,onnewscom,tengah rebak covid19 varian omicron pmi manufaktur indonesia ekspansif covid19,negative
766,2022-03-02 02:23:13+00:00,lampungpost_,covid19 indonesia tambah 24728 selasa 1 maret 2022 total konfirmasi positif indonesia capai 5589176 covid19 omicron indonesia lampostco,negative
767,2022-03-02 01:30:01+00:00,Genpi_Co,epidemiolog epidemiolog griffith university australia warning ancam omicron varian muncul omicron,negative
768,2022-03-02 00:24:12+00:00,GTVID_News,varian omicron siluman perhati serius dunia indonesia subvarian omicron nama ba2 who tular banding ba1 dominan lengkap gtvnews omicron covid19 gejalaomicron omicronsiluman,negative
769,2022-03-01 12:24:32+00:00,xyreeplease,pen ngakak nyata begituuu omicron coronationstreet miskin ngakak,negative
770,2022-03-01 12:19:36+00:00,yuzizie_,faham la still benak bawa anak2 amp tua pergi kenduri at this time of high cases tua amp anak tu dah mati covid salah sop waklu covid19 omicron,negative
771,2022-03-01 10:35:43+00:00,PostGorontalo,omicron tunai danaberobat papar covid omicron dana obat cepat,negative
772,2022-03-01 10:24:37+00:00,lensaRTV,data sebar covid19 indonesia 1 maret 2022 jawa barat wilayah catat tambah tinggi yuk sayabisadisiplinprotokolcovid19 updatecovid19 positifcovid19 omicron omicronindonesia varianomicron jawabarat jakarta jawatimur,negative
773,2022-03-01 09:02:43+00:00,beritaKBR,indonesia hadap gelombang tiga varian omicron tular varian delta upaya antisipasi dlm hadap omicron bahas ruangpublikkbr profesorzubairi podcastindonesia,negative
774,2022-03-01 08:54:32+00:00,Naylul_ir,musim omicron yg langka minyak tempe ehmm jgn obat omicron tempe goreng hmm impressive rezimpalakrakyat omicron minyaklangka tahutempemahal apaapamahal,negative
775,2022-03-01 06:28:33+00:00,Beritasatu,kerja manufaktur februari turun 512 garagara omicron baca lengkap,negative
776,2022-03-01 03:12:46+00:00,pikiran_rakyat,viral guru pidato rebut pasang siswa warganet curhat pelakor guru pidato rebut pasang pacar pelakor siswa upacara sekolah omicron covid19 video viral indonesia nasional prmn pikiranrakyat,negative
777,2022-03-01 02:24:03+00:00,Tinakaka6,hongkong lockdown 10 omicrom pergi hongkong hongkonglockdow omicron hongkongganas,negative
778,2022-01-21 23:54:37+00:00,PNawacita,kurang mobilitas rumah disiplinprokes omicron covid19,positive
779,2022-01-21 23:54:07+00:00,papuakicau,kurang mobilitas rumah disiplinprokes omicron covid19,positive
780,2022-01-21 23:53:40+00:00,Bandung4Papua,kurang mobilitas rumah disiplinprokes omicron covid19,positive
781,2022-01-21 23:52:47+00:00,MojangB97175428,warga waspada omicron disiplinprokes omicron covid19,positive
782,2022-01-21 18:00:01+00:00,matamilenialID,indonesia lambat bendung omicron baca lengkap mataindonesia sigap tangan covdi19 omicron,positive
783,2022-01-21 17:00:02+00:00,matamilenialID,banget inggris wajib masker baca lengkap mataindonesia masker covid19 inggris omicron,positive
784,2022-01-21 16:12:02+00:00,KabarSiang,syarat pasien omicron isolasi mandiri rumah omicron,positive
785,2022-01-21 14:40:02+00:00,jpnncom,plt kepala dinas kabupaten sukoharjo dr yunia wahdiyati konfirmasi omicron wilayah warga nyata sembuh omicron,positive
786,2022-01-21 13:28:12+00:00,InfokomPMK,yuk simak bijak terap strategi covid19 omicron jagaprokes,positive
787,2022-01-21 12:56:33+00:00,pikobar_jabar,baca unggah tarik oleholeh negeri satgasperubahanperilaku yuk omicron covid19 luarnegeri imigrasi pikocampaign,positive
