,date,username,Steaming,label
342,2022-06-29 12:45:53+00:00,Wulanps51383893,day 4 get better krn sdh minum anti virus yaa yg sdh lbh dahak kurang batuk jg reda tgl pusing aja msh tp hr gue work out zumba amp sunbathing makan byk omicron isoman covid19 dirumahaja,negative
343,2022-06-29 10:23:29+00:00,medcom_id,kepala dinas sehat kadinkes kota depok jawa barat mary liziawati 4 warga papar varian covid19 omicron subvarian ba4 ba5 warga nyata sembuh covid19 omicron cekdulumedcom,negative
344,2022-06-29 09:59:49+00:00,indonesia_ntd,tiongkok sembunyi informasi kait omicron tiongkok omicron pandemi wabah,negative
345,2022-06-29 02:32:03+00:00,Beritabaruco,50 covid as subvarian omicron ba4 ba5 amerikaserikat covid19 covid19varianomicron omicron,negative
346,2022-06-28 11:59:33+00:00,zazoomblog,sintomi omicron 5 sintomi omicron,negative
347,2022-06-28 10:14:59+00:00,pikiran_rakyat,update covid19 indonesia 28 juni 2022 positif tingkat 2167 hari update pasien positif tinggal dunia sembuh perintah virus corona omicron delta covid19 indonesia prmn pikiranrakyat,negative
348,2022-06-28 09:56:20+00:00,Wulanps51383893,day 3 gw msh batuk2 amp pusing tp saturasi amp suhu bdn normal gue sun bathing duh lg awat retinol hmm tunda glowing deeh yg covid minggat paket isoman dtg jg thx kemenkes kemenkesri omicron,negative
349,2022-06-28 06:35:17+00:00,mikirmedia,organisasi sehat dunia who lapor tingkat idap ganggu mental pandemi idap depresi ganggu cemas kian tingkat covid19 omicron who,negative
350,2022-06-28 03:40:22+00:00,HobbyLab88,omicron virus fyp omicron boikotaice instagramdown coronavirus holywingsindonesia,negative
351,2022-06-27 05:16:21+00:00,wartakotalive,omicron ba5 ba4 tangerang capai 46 waspada gejala flu wartakotalive omicron coronavirus,negative
352,2022-06-27 03:08:40+00:00,moeslim_choice,puncak lonjak positif covid19 akibat subvarian omicron ba4 ba5 tengah juli 2022 covid19 covid19vic omicron5 omicron,negative
353,2022-06-27 03:00:31+00:00,Berita_Orbit,dapat sobit omicron omicron5 aryasalokaday lisaxceline,negative
354,2022-06-26 19:27:38+00:00,Wulanps51383893,jg covid hadeeeuh hsl swab antigen 2 grs merah nt gue pcr tp kyk positif sich krn gue papar ipar gue yg udh duluan positif tgl 22 trs semlm gue demam amp pusing hr org rumah jadwal swab hny gw yg positif omicron,negative
355,2022-06-26 18:00:01+00:00,matamilenialID,warga jakarta disiplin prokes baca lengkap mataindonesia wargajakarta prokes covid19 omicron,negative
356,2022-06-26 13:10:13+00:00,tvOneNews,menteri sehat ri budi gunadi sadikin laju tular covid19 indonesia capai 2000 simak berita lengkap newsone cariberitaditvone omicron,negative
357,2022-06-25 23:00:01+00:00,matamilenialID,puncak subvarian omicron ba4 ba5 prediksi juli baca lengkap mataindonesia subvarian covid19 omicron puncakkasus,negative
358,2022-06-25 20:20:46+00:00,SIGILUX,avoid cphairports denmark covid19dk sarscov2 omicron ba5 cc sdicht misterblok containmentnu cmdrdrsyell roelgrif equibotanica momindystopia lostinnl esskew josephbrowning tournedisk,negative
359,2022-06-25 00:13:17+00:00,atiduduwesi,perintah waspada lonjak covid19 luar negeri indonesia waktu covid19 omicron indonesiakuathebat,negative
360,2022-06-24 09:44:09+00:00,antaranews,pek kemenkes lapor ba4 21 ba5 122 omicron,negative
361,2022-06-24 09:07:35+00:00,readers_id,omicron rebak hibur restoran makau tutup leadersarereaders omicron macau,negative
362,2022-06-24 06:46:13+00:00,lensaRTV,angka tambah subvarian omicron ba4 ba5 tingkat kondisi negara ketat atur protokol sehat negara yuk simak video omicron subvarianomicron ba4 ba5 updatecovid19,negative
363,2022-06-23 17:11:35+00:00,glen_mlj,so kes covid nak ambik 2nd booster shot la ni aka dos vaksin ke4 ka kkm kementeriankesihatan covid19 omicron malaysia,negative
364,2022-06-23 16:02:54+00:00,syawal,ingnaj sub variant omicron rebak sarawak semenanjung kumpul risiko ambil booster,negative
365,2022-06-23 12:13:12+00:00,MNowNews,kes covid19 sub varian ba2121 ba5 kes sarawak mac jun malaysianow mnow flashnews malaysia sarawak omicron,negative
366,2022-06-23 10:39:55+00:00,Kilat_com,covid19 hari indonesia sentuh 2 ribu 5 provinsi wajib waspada covid19 pandemi omicron covidisnotover omicronvariant,negative
367,2022-06-22 22:00:01+00:00,Genpi_Co,puncak covid19 omicron subvarian ba4 ba5 prediksi juli 2022 omicron,negative
368,2022-06-22 12:24:00+00:00,gen1031fmsby,sobat gen tau gejala cegah omicron varian ba4 ba5 skuy besok siang join katanetigen live instagram kalo tanyatanya tulis tanya sob infogen1031fm gen1031fmsby omicron covid19 varian,negative
369,2022-06-22 10:59:33+00:00,JurnalNews_ID,waspada ridwan kamil 17 warga jabar positif omicron ba4 ba5 jawabarat ridwankamil omicron omicron5,negative
370,2022-06-22 01:06:25+00:00,MNowNews,singapura catat tingkat 23 minggu minggu jangkit komuniti covid19 malaysianow mnow flashnews singapore covid omicron,negative
371,2022-06-22 00:13:25+00:00,atiduduwesi,satu tugas tangan satgas covid19 catat covid19 minggu 1962022 tambah 1167 tambah angka catat covid19 indonesia 6068075 omicron bersatudukungrimaju,negative
372,2022-06-21 16:20:29+00:00,PostMalaysia,subvarian omicron lari antibodi sunti sinopharm kaji cina dapat omicron sinopharm,negative
373,2022-06-21 15:49:00+00:00,kompascom,sorot naik lantas parah gejala omicron ba4 ba5 omicron,negative
374,2022-06-21 10:44:28+00:00,fajaronline,subvarian omicron ba4 ba5 tular ahli paru pandemi selesai ahliparu covid19 omicron pandemi,negative
375,2022-06-21 10:21:07+00:00,officialntv_,subvarian omicron ba4 ba5 variant of concern dokter reisa imbau masyarakat laku booster omicron omicronvariant ba4 ba5 booster newsupdate,negative
376,2022-06-21 08:18:39+00:00,chatnews_id,muncul subvariant omicron b4 b5atau ba4 ba5menjadi sebab lonjak inggris,negative
377,2022-06-21 06:01:37+00:00,rbgid_,muncul omicron ba4 ba5 80 ribu lansia singapura vaksin booster omicron beritahariini rbgid berita percaya unik eksklusif,negative
378,2022-06-21 04:09:53+00:00,gaya_id,omicron timbul risiko long covid delta simak informasi lengkap gayaid omicron covid19 variandelta pandemicovid19 sehat,negative
379,2022-06-20 02:36:10+00:00,FokusRedaksi,subvarian omicron baru deteksi indonesia fokus tetappakaimasker omicron kemenkesri,negative
380,2022-06-19 16:46:44+00:00,angel_Shaheera,smw nakes covid dpt insentif yng ga dapet gasih nasib sm nakes tenagakesehatan nakescovid covid19 coviddelta omicron insentif danainsentif,negative
381,2022-06-19 13:18:15+00:00,holopiscom,juru bicara satgas tangan covid19 wiku adisasmito tingkat covid19 daerah indonesia lengkap lawancovid19id kemenkesri covid19 omicron,negative
382,2022-06-19 13:07:41+00:00,a_djaffar,kirimin jamu beras kencurnasi kebuli kambingbeef samosa istirahatdirumah omicron fotomakanan arabjawa,negative
383,2022-06-19 09:24:00+00:00,KlikTimes,baru vaksin varianvarian covid19 muncul mampu hindar antibodi hasil vaksin lengkap baca jokowi omicron micron covid vaksin,negative
384,2022-06-19 09:03:37+00:00,pikiran_rakyat,update covid19 indonesia 19 juni 2022 positif tingkat 1167 hari update pasien positif tinggal dunia sembuh perintah virus corona omicron delta covid19 indonesia prmn pikiranrakyat,negative
385,2022-06-19 03:32:44+00:00,jpnncom,beritabali bal 42 positif varian omicron picu waspada pandemicovid19 omicron bal,negative
386,2022-06-18 19:00:00+00:00,matamilenialID,cegah lonjak akibat ba4 ba5 sistem surveilans baik baca lengkap mataindonesia ba5 covid19 omicronsubvarianba4 omicron,negative
387,2022-06-18 15:30:48+00:00,All__Incomplete,euthanasia jubilee covid19 omicron ba4 ba5,negative
388,2022-06-18 14:00:11+00:00,Kilat_com,lonjak covid keri gegara lepas masker covid19 covid covidisnotover pandemic omicron,negative
389,2022-06-18 09:45:46+00:00,pikiran_rakyat,update covid19 indonesia 18 juni 2022 positif tingkat 1264 hari update pasien positif tinggal dunia sembuh perintah virus corona omicron delta covid19 indonesia prmn pikiranrakyat,negative
390,2022-06-18 04:30:00+00:00,newsmerahputih,covid19 indonesia alami naik hari angka positif bawah standar aman who merahputihcom omicron indonesia who,negative
391,2022-06-18 04:14:01+00:00,DJ_HDIOne,3 sejak ngomong waspada waspada waspada omicron ba4 ba5 presiden terang jokowi covid19 indonesia jagainimunkamu doddyjasman omicron,negative
392,2022-06-18 01:54:01+00:00,bharianmy,bhdunia sub varian omicron baharu upaya elak antibodi hasil vaksin dos galak omicron,negative
393,2022-06-17 17:29:45+00:00,samudra_news,ri bobol omicron varian berbagicerita dailynews news beritaindonesia omicron,negative
394,2022-06-17 13:49:09+00:00,Satukata__,warga jabar papar omicron b4 b5 calon jamaah haji spostid jabar omicron calhaj spostid,negative
395,2022-06-17 12:50:24+00:00,EmMicucci,covid lazio 4826 contagiati roma omicron,negative
396,2022-06-17 08:18:00+00:00,Jawaban,mutasi omicron subvarian ba4 ba5 indonesia konfirmasi tambah lipat kondisi waspada yuk berita lengkap omicron covid19 covidisnotover jawabancom,negative
397,2022-06-17 05:29:00+00:00,kompascom,kemenkes lapor 20 covid19 akibat tular subvarian omicron ba4 ba5 indonesia omicron,negative
398,2022-06-17 03:00:01+00:00,ThePhraseID,hari covid19 indonesia tembus 1000 thephraseid covid19 subvarianomicron omicron,negative
399,2022-06-17 01:42:46+00:00,rti_rtisi,omicron varian ba4 ba5 temu negara dunia varian cemas tingkat gelombang tular,negative
400,2022-06-16 14:17:38+00:00,SmashNewsCorp,smash news subvarian omicron ba4 ba5 milik mampu turun mampu terapi antibodi monoklonal immune escape smashnews beritaterbaru kabarterkini virus omicron covid19 vaksin,negative
401,2022-06-16 12:23:26+00:00,antaranews,tambah akumulasi konfirmasi positif pandemi indonesia maret 2020 6064424 kasuscovid19 omicron,negative
402,2022-06-16 12:00:01+00:00,newsmerahputih,naik covid19 pekan menkes kira puncak subvarian omicron juli 2022 merahputihcom omicron menkes pandemi,negative
403,2022-06-16 11:14:20+00:00,antaranews,kami surat edar dinas sehat rumah sakit waspada lonjak omicron jubir kemenkes jubirkemenkes omicron,negative
404,2022-06-16 10:59:59+00:00,lensaRTV,menko luhut larang lansia rumah bulan hoaks coba stefani ginting yuk saring sharing viral luhut luhutbinsarpandjaitan menkomarves lansia updatecovid19 omicron hoax hoaks beritahoaks fakta,negative
405,2022-06-16 10:56:47+00:00,infoJATIASIH,3 omicron usia 512 tahun ptm kabar,negative
406,2022-06-16 10:11:45+00:00,pikiran_rakyat,update covid19 indonesia 16 juni 2022 positif tingkat 1173 hari update pasien positif tinggal dunia sembuh perintah virus corona omicron delta covid19 indonesia prmn pikiranrakyat,negative
407,2022-06-16 09:02:00+00:00,disway_id,gelombang omicron varian ba4 ba5 juli menkes pesan presiden hatihati varianba4danba5 gelombang omicron mentrikesehatan covid19 who kemenkesri klik,negative
408,2022-06-16 07:58:30+00:00,lampungpost_,milik gejala rendah varian dahulu menteri sehat menkes budi gunadi sadikin puncak covid19 omicron varian ba4 ba5 maksimum capai 25 ribu omicron lampungpost,negative
409,2022-06-16 07:51:39+00:00,pikiran_rakyat,pakar sorot naik covid19 indonesia situasi sulit covid19 tjandrayogaaditama omicron prmn pikiranrakyatmedianetwork potensilokalgonasional kolaborasimediapreneurnusantara pikiranrakyat,negative
410,2022-06-16 07:03:56+00:00,akusehatklinik,sobat sehat menteri sehat menkes budi gunadi sadikin negara hadap gelombang virus corona varian ba4 ba5 perintah prediksi puncak gelombang juli omicron subvarian covid19,negative
411,2022-06-16 06:55:41+00:00,PrabuRyan3,lebaran haji covid varian kasus bgt main perintah covid19 omicron fandom jordan,negative
412,2022-06-16 06:54:32+00:00,murianewscom,puncak omicron ba4 ba5 prediksi juli lengkap klik taut jakarta omicron ba4 ba5 covid19,negative
413,2022-06-16 06:07:52+00:00,RADARSOLO_,puncak covid19 omicron varian ba4 ba5 maksimum capai 25000 omicronba omicron airlanggahrt,negative
414,2022-06-16 02:10:29+00:00,MC_Nishidella98,tgl 1 agustus yg perintah naik omicron subvarian ba3 ba4 covid19 omicron bahayaomicron 1agustus pemerintahbaru semakinbahaya,negative
415,2022-06-16 02:08:56+00:00,MC_Nishidella98,covid19 indonesia parah tular bahaya sebar tular covid19 covid19 omicron bahayaomicron kemenkesri satgascovid19 bnpbindonesia,negative
416,2022-06-16 01:53:35+00:00,IDbelasting,varian omicron ba4 ba5 duga kuat sebab omicron varianomicron omicronba4 omicronba5 omicronnaiklagi covidnaiklagi,negative
417,2022-06-15 15:05:04+00:00,kuninganreligi,omicron ba4 ba5 sebab naik covid19 kondisi kabupaten kuningan omicronba omicron kuningan sehat sehatesokdimulaikini,negative
418,2022-06-15 14:20:41+00:00,Hi_pontianak,update covid19 1242 konfirmasi positif 8 tinggal hi pontianak corona covid19 omicron omicronba lawanvarianbaru,negative
419,2022-06-15 10:20:00+00:00,newsmerahputih,lonjak covid19 indonesia jubir perintah tangan covid19 atur giat skala merahputihcom corona perintah omicron merahputihcom corona perintah omicron,negative
420,2022-06-15 10:18:57+00:00,pikiran_rakyat,update covid19 indonesia 15 juni 2022 angka sembuh tingkat 525 hari update pasien positif tinggal dunia sembuh perintah virus corona omicron delta covid19 indonesia prmn pikiranrakyat,negative
421,2022-06-15 10:16:32+00:00,kumparanMOM,covid19 indonesia tingkat varian omicron ba4 ba5 stay safe moms simak lengkap klik link bio download aplikasi kumpar app store google play kumparanmom infografis omicron,negative
422,2022-06-15 10:08:00+00:00,FalkonIndo,taiwan deteksi omicron ba4 ba5 tengah ledak covid taiwan omicron covid19 varian,negative
423,2022-06-15 08:25:13+00:00,chatnews_id,who klasifikasi subvarian ba4 ba5 varian perhati omicron,negative
424,2022-06-15 06:16:11+00:00,prosehat,muncul subvarian omicron ba4 ba5 deteksi indonesia timbul khawatir tengah longgar masker lantas cegah simak lengkap thread bawah,negative
425,2022-06-15 02:20:12+00:00,Kilat_com,duh covid tambah 930 papar covid19 omicron omicronba coronavirus pandemic,negative
426,2022-06-14 15:34:49+00:00,MC_Nishidella98,sifat jd kampanye promoted presidensi g20 indonesia tengah jelang lonjak covid19 omicron subvarian ba3 ba4 covid19 omicron bahaya g20indonesia,negative
427,2022-06-14 13:57:54+00:00,Kilat_com,varian ba4 ba5 beda omicron omicron omicronba covid19 pandemi,negative
428,2022-06-14 13:30:00+00:00,SeputariNews,covid19 subvarian omicron ba4 ba5 temu bal kait masyarakat tingkat waspada hel seputarinewsrcti covid19 corona varian omicron bal waspada,negative
429,2022-06-14 12:06:25+00:00,kumparanplus,naik covid19 sebab muncul virus omicron varian ba4 ba5 lonjak 500 600an tinggi 300 covid19 omicron ba4 ba5,negative
430,2022-06-14 11:25:11+00:00,HalodocID,oh gak anggap sepele udah vaksin potensi jangkit covid19 varian sempet vaksin yuk sempat vaksin lupa jaga prokes tweeps covid19 prokes omicron,negative
431,2022-06-14 10:42:23+00:00,Kilat_com,varian ba4 ba5 beda omicron covid19 omicron omicronba4 omicronba5 omicronba idi,negative
432,2022-06-14 10:15:10+00:00,mediapilarID,20 sub varian omicron ba4 ba5 indonesia pilarid omicron,negative
433,2022-06-14 06:55:37+00:00,_jejakkita,wkwkwk ngakak baca komennya ajaa nih si omicron ba udah selesai masa omicron x btsfesta2022 bitcoincrash emeteraidimensy ourstarlighttaeilday nbafinals umacancaoparati lalisa enhypen,negative
434,2022-06-14 06:41:23+00:00,holopiscom,naik covid19 negara indonesia sebab subvarian ba4 ba5 lengkap kemenkesri lawancovid19id omicron ba4 ba5,negative
435,2022-06-14 06:13:03+00:00,MNowNews,takat 4 jun sub varian ba4 ba5 anggar bentuk 5 8 kes covid19 amerika syarikat malaysianow mnow mnownews omicron covid19 europe america,negative
436,2022-06-14 03:31:19+00:00,koranjakarta_id,gempar endemi menkes prediksi puncak omicron ba4 ba5 picu gelombang koranjakarta nasional menkes covid19 omicron indonesia,negative
437,2022-06-14 03:00:00+00:00,ThePhraseID,temu indonesia gejala subvarian ba4 ba5 thephraseid subvarianomicron omicronba omicron,negative
438,2022-06-14 02:22:32+00:00,vdvc_talk,subvarian covid19 omicron ba4 ba5 deteksi dki jakarta 4 menteri sehat kemenkes umum temu 4 ba4 ba5 bal waspada jaga prokes sobat vdvc vdvctalk omicron covid19,negative
439,2022-06-14 01:31:00+00:00,tribunkaltim,subvarian omicron ba4 ba5 indonesia potensial tular waspada viruscorona covid19 covid19indonesia omicronba4 omicronba5 omicron tribunkaltim,negative
440,2022-06-13 22:00:02+00:00,Genpi_Co,epidemiolog griffith university dicky budiman muka subvarian omicron ba2 ba5 peluang picu gelombang covid19 omicron,negative
441,2022-06-13 13:30:00+00:00,newsmerahputih,pandemi virus covid19 subvarian omicron baru temu jakarta merahputihcom corona jakarta omicron,negative
442,2022-06-13 10:30:00+00:00,GTVID_News,menteri sehat mutasi covid19 omicron sub varian ba4 ba5 sebar jumlah daerah indonesia mei 2022 cen gtvnews buletininews covid19 omicron varianbaru kemenkes,negative
443,2022-06-13 09:38:40+00:00,faktualid_com,deteksi indonesia perintah cek rs sedia obat antisipasi omicron ba4ba5 omicron covid19,negative
444,2022-06-13 09:36:12+00:00,akusehatklinik,sobat sehat muncul subvarian omicron ba4 ba5 lapor bal total vaksinasi lengkap dosis vaksin covid19 omicron covid19 testcovid,negative
445,2022-06-13 09:03:30+00:00,IDbelasting,tingkat tular subvarian omicron ba4 ba5 omicron varianbaruomicron subvarianomicron,negative
446,2022-06-13 08:36:35+00:00,tribunkaltim,subvarian omicron ba4 ba5 indonesia potensial tular waspada viruscorona covid19 covid19indonesia omicronba4 omicronba5 omicron tribunkaltim,negative
447,2022-06-13 08:32:24+00:00,lensaRTV,tular covid19 indonesia alami tingkat menteri sehat budi gunadi sadikin 8 indonesia infeksi subvarian omicron ba4 ba5 kemenkes omicron omicronbaru ba4 ba5 pasiencovid19 updatecovid19,negative
448,2022-06-13 04:00:00+00:00,poskotaofficial,covid19 subvarian omicron ba4 ba5 deteksi indonesia gejala covid19 omicron,negative
449,2022-06-13 03:40:47+00:00,antaranews,subvarian omicron ba4 ba5 deteksi indonesia 6 juni 2022 yuk kenal gejala omicron laman infografik,negative
450,2022-06-13 02:25:28+00:00,PrakosoAdmajaya,subvarian ba4 ba5 milik mampu hindar sistem kebal imun manusia covid covid19 omicron varianbaru varianbarucorona sehat,negative
451,2022-06-13 02:23:28+00:00,Dewianjani97,subvarian ba4 ba5 turun omicron infeksi anakanak tular varian covid covid19 omicron varianbaru varianbarucorona sehat,negative
452,2022-06-13 00:25:05+00:00,inilahdotcom,covid19 subvarian omicron ba4 ba5 temu indonesia bal harus khawatir covid19 omicron,negative
453,2022-06-12 18:00:00+00:00,matamilenialID,epidemiolog ingat omicron ba4 ba5 ledak indonesia baca lengkap mataindonesia covid19 dickybudiman omicron,negative
454,2022-06-12 08:35:00+00:00,kompascom,juru bicara menteri sehat mohammad syahril subvarian omicron ba4 ba5 indonesia pertama temu bal jernihkanharapan videokompas omicron,negative
455,2022-06-12 08:28:23+00:00,RunningTextID,omicron varian ba4 ba5 tambah 8 omicron covid19 covid corona pdpi,negative
456,2022-06-12 07:06:44+00:00,OfficialiNewsTV,omicron varian indonesia kemenkes sebut trasmisi subvarian omicron ba4 ba5 sebar cepat banding varian tingkat sakit nilai rendah lengkap inews omicron,negative
457,2022-06-12 02:03:03+00:00,nusabalicom,4 varian omicron temu bal berita nusabali omicron covid19,negative
458,2022-06-11 23:08:36+00:00,tribunbalikanal,4 positif omicron ba4 ba5 temu bal warga panik covid covid19,negative
459,2022-06-11 03:00:00+00:00,lensaRTV,jubir kemenkes dr mohammad syahril konfirmasi subvarian omicron ba4 ba5 indonesia pasien papar ba4 status wni sisa infeksi ba5 status wna kemenkes omicron omicronbaru pasiencovid19,negative
460,2022-06-10 11:28:09+00:00,murianewscom,kemenkes 4 covid19 subvarian omicron ba4 ba5 bal lengkap klik taut jakarta kemenkes kasuscovid19 omicron bal,negative
461,2022-06-10 06:33:04+00:00,Beritabaruco,4 subvarian omicron ba4 ba5 temu bal budigunadisadikin menkes omicron,negative
462,2022-06-10 00:34:41+00:00,MNowNews,menteri kesihatan khairy jamaluddin varian kesan negara malaysianow mnow mnownews malaysia covid omicron,negative
463,2022-06-08 14:09:36+00:00,OptionT02594842,maskup mumbai omicron,negative
464,2022-06-08 07:54:57+00:00,akusehatklinik,sobat sehat kondisi pandemi baik negara gelombang afsel portugal akibat omicron ba4 ba5 sehat omicron ba4 ba5,negative
465,2022-06-07 05:31:14+00:00,monitorindo,bor johnson lolos mosi percaya partygate borisjohnson mositidakpercaya partygate pestaulangtahun covid19 lockdown omicron pminggris,negative
466,2022-06-07 04:18:00+00:00,disway_id,singapura prediksi terpa gelombang omicron juli 2022 indonesia wajib waspada ongyekung mentrikesehatansingapura omicron varianbaru singapura covid19 klik,negative
467,2022-06-05 09:16:04+00:00,pikiran_rakyat,update covid19 indonesia 5 juni 2022 angka sembuh tingkat 204 hari update pasien positif tinggal dunia sembuh perintah virus corona omicron delta covid19 indonesia prmn pikiranrakyat,negative
468,2022-06-04 08:32:26+00:00,pikiran_rakyat,update covid19 indonesia 4 juni 2022 angka sembuh tingkat 258 hari update pasien positif tinggal dunia sembuh perintah virus corona omicron delta covid19 indonesia prmn pikiranrakyat,negative
469,2022-06-03 06:39:04+00:00,SIGILUX,cduitsland roelgrif told summerwave omicron ba5,negative
470,2022-05-31 13:30:00+00:00,XHSwahili,sekta utengenezaji wa china imekuwa bora zaidi mnamo mei kwani viwanda vingi vinaanza tena uzalishaji baada mlipuko wa omicron kudhibitiwa,negative
471,2022-05-29 10:14:07+00:00,pikiran_rakyat,update covid19 indonesia 29 mei 2022 angka sembuh tingkat 261 hari update pasien positif tinggal dunia sembuh perintah virus corona omicron delta covid19 indonesia prmn pikiranrakyat,negative
472,2022-05-28 09:45:57+00:00,pikiran_rakyat,update covid19 indonesia 28 mei 2022 angka sembuh tingkat 248 hari update pasien positif tinggal dunia sembuh perintah virus corona omicron delta covid19 indonesia prmn pikiranrakyat,negative
473,2022-05-27 08:28:54+00:00,pikiran_rakyat,update covid19 indonesia 27 mei 2022 angka sembuh tingkat 277 hari update pasien positif tinggal dunia sembuh perintah virus corona omicron delta covid19 indonesia prmn pikiranrakyat,negative
474,2022-05-26 08:49:59+00:00,pikiran_rakyat,update covid19 indonesia 26 mei 2022 angka sembuh tingkat 243 hari update pasien positif tinggal dunia sembuh perintah virus corona omicron delta covid19 indonesia prmn pikiranrakyat,negative
475,2022-05-25 10:28:10+00:00,pikiran_rakyat,update covid19 indonesia 25 mei 2022 angka sembuh tingkat 232 hari update pasien positif tinggal dunia sembuh perintah virus corona omicron delta covid19 indonesia prmn pikiranrakyat,negative
476,2022-05-25 03:00:02+00:00,ThePhraseID,subvarian omicron afrika selatan bahaya thephraseid covid19 omicron covid,negative
477,2022-05-23 23:40:20+00:00,HEARDatUNSW,tulio de oliveira and sikhulile moyo omicron,negative
478,2022-05-23 23:07:59+00:00,productofyr,meanwhile corona pandemic covid19 delta alpha omicron today tomorrow monkeys planetoftheapes japan,negative
479,2022-05-20 11:05:11+00:00,MediakomKemkes,omicron indonesia tingkat pandemicovid peristiwa,negative
480,2022-05-20 09:47:01+00:00,akusehatklinik,sobat sehat singapura lapor covid19 komunitas subvarian omicron ba4 ba5 menteri sehat singapura moh tingkat upaya awas pantau sebar ba4 ba5 negara covid19 omicron,negative
481,2022-05-18 13:06:08+00:00,MC_Nishidella98,covid19 omicron korea utara lonjak parah yg sedia obatobatan alat tes antigen alat tes pcr alat sehat perintah negara korea selatan covid19 omicron omicronba2 who lockdown bahaya,negative
482,2022-05-18 12:55:17+00:00,CISDI_ID,waspada muncul subvarian omicron ba4 ba5 singapura thread omicron covid19singapura,negative
483,2022-05-17 09:52:20+00:00,MNowNews,benar minta dos tiga kanakkanak usia 11 tahun malaysianow news flashnews fda covid19 omicron,negative
484,2022-05-17 07:04:35+00:00,heesooluh,ayun lang omicron,negative
485,2022-05-16 09:24:22+00:00,MC_Nishidella98,singapura umum covid19 omicron subvarian ba4 ba5 yg deteksi lonjak omicron hasil riset menteri sehat singapura covid19 omicron omicronba4 omicronba5 who lonjakkankasusomicron,negative
486,2022-05-16 08:00:02+00:00,holopiscom,subvarian omicron deteksi singapura ba4 lokal ba5 omicron covid19 singapura,negative
487,2022-05-15 09:15:05+00:00,pikiran_rakyat,update covid19 indonesia 15 mei 2022 angka sembuh tingkat 293 hari update pasien positif tinggal dunia sembuh perintah virus corona omicron delta covid19 indonesia prmn pikiranrakyat,negative
488,2022-05-14 18:10:19+00:00,SaptaSahasrani,ferdymad perupadata perhati 3 berturutturut trend aktif tingkat global kumulatif ratarata hari tembus rekor rendah puncak omicron covid19 tahun 2022,negative
489,2022-05-14 11:22:24+00:00,mainmainid_,teliti jepang curiga hubung varian omicron hepatitis anak omicron covid19,negative
490,2022-05-14 10:14:39+00:00,pikiran_rakyat,update covid19 indonesia 14 mei 2022 angka sembuh tingkat 416 hari update pasien positif tinggal dunia sembuh perintah virus corona omicron delta covid19 indonesia prmn pikiranrakyat,negative
491,2022-05-14 07:09:00+00:00,tribunkaltim,hepatitis akut anak teliti jepang temu korelasi covid19 varian omicron hepatitisakut covid19 omicron anak tribunkaltim,negative
492,2022-05-13 21:26:33+00:00,tribunkaltim,hepatitis akut anak teliti jepang temu korelasi covid19 varian omicron hepatitisakut covid19 omicron anak tribunkaltim,negative
493,2022-05-12 19:00:00+00:00,matamilenialID,naik 50 covid19 warga jakarta waspada tular omicron baca lengkap mataindonesia kasuscovid19 jakarta omicron,negative
494,2022-05-12 07:22:51+00:00,pikiran_rakyat,korea utara umum covid19 kim jong un gelar rapat darurat covid19 omicron korut kimjongun via youtube,negative
495,2022-05-11 19:59:57+00:00,notyourgulabo,kya matlab phir parhna chor dn mai omicron boardexams coronavirus,negative
496,2022-05-11 13:07:55+00:00,gbwt19,ngo in lahore gunj bakhsh welfare trust gbwt hashtags omicron zardari gbwt,negative
