,date,username,Steaming,label
0,2022-01-21 22:33:07+00:00,sauditvnews_ma,pakar imunologi rusia nickolay kryuchkov dedah bahawa ubah tingkah gaya hidup abai tabiat kanakkanak tanda jangkit varian omicron malaysia omicron,negative
1,2022-01-21 16:55:51+00:00,BhullakkadBabu,how to interpret rat rat ka result dekho phir kundli dekho phir toss coin phir decide karo ko kya hua covid omicron covidguidelines,negative
2,2022-01-21 16:35:57+00:00,serambinews,omicronjepangpembatasan covid19 jepang luas batas covid19 varian omicron sebab lonjak level tinggi wilayah metropolitan,negative
3,2022-01-21 16:35:51+00:00,pakarnur,omicronjepangpembatasan covid19 jepang luas batas covid19 varian omicron sebab lonjak level tinggi wilayah metropolitan,negative
4,2022-01-21 15:28:14+00:00,murianewscom,metro jateng ganjar benar sembilan jateng papar omicron lengkap klik taut semarang gubernur jateng ganjar omicron,negative
5,2022-01-21 14:31:30+00:00,rmoljateng,wali kota aku pasien omicron kalong klikrmol,negative
6,2022-01-21 14:27:39+00:00,rmoljateng,warga semarang positif omicron rawat klikrmol,negative
7,2022-01-21 13:38:14+00:00,rmoljateng,warga semarang konfirmasi positif omicron klikrmol,negative
8,2022-01-21 13:35:02+00:00,jpnncom,dinkes cimahi konfirmasi warga wilayah papar virus covid19 varian omicron omicron,negative
9,2022-01-21 12:53:50+00:00,prasadja,siap2 vitamin stock obat pribadi sigh omicron,negative
10,2022-01-21 12:53:50+00:00,chatnews_id,puncak tular covid19 varian omicron ke40 indonesia februari maret omicron covid19,negative
11,2022-01-21 12:27:33+00:00,ruai_tv,omicron kalbar perhati ekstra satgas batas indonesiamalaysia varian omicron kalbar covid19 kalimantan pontianak varianomicron omicronmasukkalbar,negative
12,2022-01-21 12:19:40+00:00,elvirobiaa,gejala omicron gejala omicron,negative
13,2022-01-21 11:22:19+00:00,InewsPurwokerto,1 papar omicron cilacap kadinkes warga cilacap beritaterkini berita omicron beritaviral covid19,negative
14,2022-01-21 11:17:50+00:00,Beritasatu,duh 87 jemaah umrah positif covid19 omicron baca lengkap,negative
15,2022-01-21 11:13:24+00:00,Beritasatu,wow 9 pasien covid19 jawa tengah konfirmasi omicron baca lengkap,negative
16,2022-01-21 10:59:30+00:00,InewsPurwokerto,9 positif omicron jawa tengah 1 antar cilacap berita beritaterkini cilacap covid19 omicron,negative
17,2022-01-21 10:55:32+00:00,murianewscom,metro jateng omicron jateng sembilan papar lengkap klik taut semarang omicron jateng,negative
18,2022-01-21 10:55:02+00:00,jpnncom,keluarga kota semarang papar varian omicron kronologi lengkap omicron,negative
19,2022-01-21 10:47:43+00:00,antaranews,yana mulyana enam warga positif omicron transmisi lokal milik riwayat jalan negeri,negative
20,2022-01-21 10:42:51+00:00,PingPointID,pemprov jawa barat barubaru kota depok kota wilayah lonjak covid19 tinggi provinsi covid19depok omicron omicrondepok varianomicron,negative
21,2022-01-21 10:05:03+00:00,medianekita,pulang tanah suci 87 jemaah umrah indonesia konfirmasi covid19 10 probable omicron umrah covid19 omicron indonesia,negative
22,2022-01-21 09:49:21+00:00,antaranews,sembilan pasien konfirmasi positif omicron jateng sebar semarang cilacap kalong sukoharjo,negative
23,2022-01-21 09:48:38+00:00,onnewscom,kemenkes 87 jemaah umrah indonesia positif covid19 omicron,negative
24,2022-01-22 18:00:01+00:00,matamilenialID,omicron laku jalan arab saudi baca lengkap mataindonesia omicron jalan arabsaudi covid19,negative
25,2022-01-22 15:37:00+00:00,tribunkaltim,jadi indonesia 2 pasien covid19 omicron tinggal dunia prediksi gelombang tiga covid19indonesia covid19 omicron via tribunkaltim,negative
26,2022-01-22 15:16:48+00:00,Media_Rania,mati akibat omicron seberang tambak bukti covid19 main singapore omicron,negative
27,2022-01-22 14:57:52+00:00,fajaronline,jakarta waspada omicron wagub positif tambah 1177 kasusomicronjakarta omicron wagubjakarta,negative
28,2022-01-22 14:49:28+00:00,infopenanews,pasien konfirmasi omicron tinggal dunia omicron,negative
29,2022-01-22 14:46:25+00:00,fajaronline,pasien covid19 varian omicron tinggal dunia covid19 meninggaldunia omicron,negative
30,2022-01-22 14:45:34+00:00,LarosMedia,breaking news pasien infeksi covid 19 varian omicron tinggal nadia siti wajib masker omicron covid19 indonesia,negative
31,2022-01-22 14:11:43+00:00,Vickey_Vijay_22,sridharsw intha omicron yepada poi tolivan theatre ku poi yepa intha padathalam papom beast,negative
32,2022-01-22 14:00:10+00:00,antaranews,kemenkes lapor pasien konfirmasi omicron tinggal dunia pasien transmisi lokal laku jalan negeri,negative
33,2022-01-22 13:43:48+00:00,chatnews_id,pasien tinggal positif omicron transmisi lokal laku jalan negeri omicron covid19,negative
34,2022-01-22 13:09:03+00:00,terkinidotid,omicron rambak sulsel warga takalar malu pasien satgas covid19 sulawesi selatan sulsel lapor varian omicron sulsel alami warga kabupaten takalar news omicronsulsel omicron,negative
35,2022-01-22 12:54:37+00:00,bharianmy,bhdunia mangsa usia 92 tahun vaksin omicron coronavirus covid19,negative
36,2022-01-22 12:50:59+00:00,tribunkaltim,jadi indonesia 2 pasien covid19 omicron tinggal dunia prediksi gelombang tiga covid19indonesia covid19 omicron via tribunkaltim,negative
37,2022-01-22 12:18:02+00:00,KabarSiang,indonesia umum 2 pasien omicron tinggal omicron,negative
38,2022-01-22 12:15:32+00:00,inewsdotid,2 pasien omicron tinggal komorbid laku jalan negeri omicron,negative
39,2022-01-22 12:10:45+00:00,holopiscom,satu transmisi lokal tinggal rs sari asih ciputat laku jalan negeri tinggal rspi sulianti saroso juru bicara menteri sehat siti nadia tarmizi sabtu 221 lawancovid19id kemenkesri omicron,negative
40,2022-01-22 12:02:05+00:00,inewsdotid,breaking news omicron 2 pasien tinggal omicron,negative
41,2022-01-22 12:00:58+00:00,Beritasatu,indonesia catat 2 mati akibat varian omicron baca lengkap,negative
42,2022-01-22 11:59:53+00:00,_infoindonesia,menteri sehat kemenkes umum pasien rawat akibat papar varian omicron tinggal dunia mati akibat omicron indonesia omicron,negative
43,2022-01-22 11:54:28+00:00,kompascom,satu transmisi lokal tinggal rumah sakit rs sari asih ciputat laku jalan negeri tinggal rspi sulianti saroso nadia sabtu 2212022 breakingnews omicron indonesia,negative
44,2022-01-22 11:45:59+00:00,chatnews_id,1027 papar omicron 747 milik riwayat jalan negeri 280 transmisi lokal covid19 omicron,negative
45,2022-01-22 11:40:36+00:00,OfficialiNewsTV,lapor fatalitas indonesia akibat varian milik daya tular tinggi inews pasiencovid19 pasienomicron omicron kasusomicron omicronindonesia covid19omicron covid19,negative
46,2022-01-22 11:04:16+00:00,pikiran_rakyat,update covid19 indonesia 22 januari 2022 tambah 3000 positif update pasien positif tinggal dunia sembuh perintah virus corona omicron delta covid19 indonesia prmn pikiranrakyat,negative
47,2022-01-22 10:55:19+00:00,LaibaTariq04,apna khyl rkhyn sb hr dosra bnda bimar ho rha coronavirus omicron,negative
48,2022-01-22 10:43:10+00:00,aewin86,duga tembus 3000 hari omicron covid19,negative
49,2022-01-22 10:07:11+00:00,fajaronline,kemenkes catat 1161 omicron indonesia ppln arab saudi arabsaudi kemenkes omicron ppln,negative
50,2022-01-22 09:56:13+00:00,tvOneNews,menteri sehat budi gunadi sadikin benar serang covid 19 varian omicron indonesia transmisi lokal baca berita lengkap newsone cariberitaditvone omicron menkes,negative
51,2022-01-22 09:22:03+00:00,inewsdotid,dampak omicron 15 sekolah jakarta tutup omicron,negative
52,2022-01-22 09:14:15+00:00,solotrustcom,omicron lonjak menkes puncak omicron waktu 40 omicron covid19 baca,negative
53,2022-01-23 22:55:04+00:00,KabarSiang,temu omicron klaster keluarga omicron,negative
54,2022-01-23 22:36:08+00:00,Hadiabusabikira,sekolah daring omicron pjj daring sekolah ptm,negative
55,2022-01-23 20:55:28+00:00,lovepatry_34,bangsa arab puja puja gilir kalimantan bilang monyet keparat bajing tangkapedymulyadi omicron louistomlinsonworldtour2022 louistomlinson besok senin,negative
56,2022-01-23 20:35:15+00:00,JayPNdayisabye,ikinyagwa cya omicron ubu ntikiye bahu cyari cyaduciyemo igikuba we wabona kigiye numubano wa south and north nawo ukagaruka inkiko zigafunguka tukavira rimwe mu gihome inzi nzozi ndaza kuzikabya tuu,negative
57,2022-01-23 15:00:00+00:00,SeputariNews,menteri sehat umum mati akibat covid19 varian omicron pasien omicron tinggal dunia lapor milik sakit serta komorbid cen rcti seputarinewsrcti kemenkes mati omicron covid19,negative
58,2022-01-23 14:04:43+00:00,QEBNA,derite holeo ojha bujhlo kintu tao abar ordhek thik bujhlo ei bubble concepttai vulval bises kore omicron khetre emni emni ki europe kono league bio bubble proyog korche na besh kichu din,negative
59,2022-01-23 12:56:23+00:00,wartakotalive,tutup alunalun kota tangerang masyarakat kesal fasilitas olahraga tutup alunalunkotatangerang omicron,negative
60,2022-01-23 12:34:32+00:00,monitorindo,omicron tingkat selandia laku lockdown pm jacinda ardern batal nikah omicron covid19 jacindaardernbatalnikah lockdown selandiabaru pmjacindaardern,negative
61,2022-01-23 12:27:01+00:00,jpnncom,sebar covid19 varian omicron dki rangkak luas varian b11529 aktif covid19 dki lonjak omicron,negative
62,2022-01-23 11:45:43+00:00,cartoon_hariom,omicron ki pita omicroninindia omicron uttarpradeshelection2022 uttarakhandelections2022,negative
63,2022-01-23 11:36:35+00:00,fajaronline,update covid19 indonesia tambah 2925 tinggal 14 kemenkes omicron perkembangancovid updatecovid019,negative
64,2022-01-23 10:52:00+00:00,HastoSuprayogo,pm new zealand batal resepsi nikah garagara omicron,negative
65,2022-01-23 10:43:14+00:00,pikiran_rakyat,update covid19 indonesia 23 januari 2022 aktif tambah 2000 update pasien positif tinggal dunia sembuh perintah virus corona omicron delta covid19 indonesia prmn pikiranrakyat,negative
66,2022-01-23 10:00:02+00:00,Genpi_Co,menteri sehat india catat covid19 angka 300 ribu berturutturut omicron,negative
67,2022-01-23 09:11:29+00:00,jhusilkiro2,pan to oli covid omicron nepal,negative
68,2022-01-23 08:34:42+00:00,TenerifeTommy,rt rheapara rt japenwpkl penting dos galak vaksin covid19 tri nilai kendiri covid19 kempen putus rantai covid19 keluarga malaysia iow komunikasikita omicron tri keluargamalaysia lindungdirilindungsemua,negative
69,2022-01-23 08:34:38+00:00,TenerifeTommy,rt rheapara rt japenwpkl kempen putus rantai covid19 keluarga malaysia iow komunikasikita omicron tri keluargamalaysia lindungdirilindungsemua kitajagakita kitamestimenang menangbersama covid19 coronavirus klceria,negative
70,2022-01-23 08:26:33+00:00,Beritasatu,pasien covid19 varian omicron tinggal dunia rs sari asih ciputat kota tangerang selatan 12 januari 2022 lengkap omicron,negative
71,2022-01-23 07:00:01+00:00,validnewsid,satgas tangan covid19 catat positif covid19 tambah 3205 sabtu 221 jakarta tambah tinggi 1825 laksana prokes sobat valid omicron covid19validnews,negative
72,2022-01-23 05:43:48+00:00,VideoTRIBUN,jelas kemenkes 2 kabar tinggal covid19 varian omicron omicron indonesia omicronvirus beritaterkini baca selengkapnyagt,negative
73,2022-01-23 05:34:48+00:00,heraldindo,omicron jakarta 1000 reaksi wagub omicron omicronjakarta,negative
74,2022-01-23 05:02:03+00:00,terkinidotid,omicron indonesia tembus angka 1000 pasien tinggal dunia mantan direktur who buka suara menteri sehat kemenkes lapor mati pasien covid19 varian omicron indonesia news omicron varianbarucovid,negative
75,2022-01-24 22:00:01+00:00,kompascom,menko marves luhut binsar pandjaitan gejala papar varian omicron sulit beda flu omicron corona pandemi jernihkanharapan,negative
76,2022-01-24 21:02:21+00:00,arini_rizka,teliti baru efek vaksin ke4 covid manula covid delmicron florona omicron,negative
77,2022-01-24 19:00:00+00:00,matamilenialID,gegara omicron pm selandia jacinda ardern batal nikah baca lengkap mataindonesia omicron pmselandiabaru batalnikah,negative
78,2022-01-24 18:45:00+00:00,newsonepk,bayania 24january2022 dr javed akram abdul basit abid hasan newsone bayania waheedh35 jakramaimc pmimrankhan pmimrankhan justiceayeshamalik covid19 omicron corruption mypmimrankhan polio,negative
79,2022-01-24 18:37:14+00:00,newsonepk,for gharidah 24jaunary2022 ali muhammad khan khurram dastgir newsone gfarooqi alimuhammadpti kdastgirkhan qamarkairappp gharidahfarooqi gfg pmimrankhan justiceayeshamalik covid19 omicron corruption mypmimrankhan,negative
80,2022-01-24 15:06:22+00:00,DobtrinsFD,indonesia negara pintar indonesia ajar sejarah alam mau sejarah omicron,negative
81,2022-01-24 14:38:22+00:00,aewin86,demam tanda papar varian delta omicron batuk entry point batuk kering 7 63 persen nyeri tenggorok 6 54 persen pilek 3 27 persen sakit kepala 4 36 persen nyeri perut 1 demam 2 18 persen,negative
82,2022-01-24 14:25:19+00:00,JamiiForums,israel yadhibiti omicron baada kutoa dozi nne wizara afya israel imesema watu wenye umri wa miaka 60 na kuendelea waliopata chanjo nne wameonesha kuwa na kinga ugonjwa mara tatu zaidi kuliko wale waliopata dozi tatu soma uviko3,negative
83,2022-01-24 14:12:10+00:00,KashConvener,csircdri scientists develop rtpcr kit for omicron variant csirind csircdri directorcdri,negative
84,2022-01-24 13:00:01+00:00,sehatq,indonesia catat mati varian omicron sabtu 221 juru bicara kemenkes ri siti nadia tarmizi pasien tinggal milik sakit komorbid sakit covid19 omicron,negative
85,2022-01-24 12:45:02+00:00,terkinidotid,ptm batas 100 persen sekolah lanjut sebar omicron lonjak perintah ajar tatap muka ptm batas 100 persen sekolah lanjut sebar virus corona news ptm omicron,negative
86,2022-01-24 12:33:56+00:00,monitorindo,sebar 31 sekolah jaksel pemkot temu 57 siswa papar covid19 ptm ptm omicron covid19 sekolahdijaksel walikotajaksel munjirin,negative
87,2022-01-24 11:25:13+00:00,jatimhariini_,aktif covid19 lumajang pasien suspek omicron omicron covid19 lumajang jatimhariini,negative
88,2022-01-24 11:05:01+00:00,jpnncom,menko marves luhut binsar panjaitan sebut covid19 varian omicron akibat lonjak mati jelas omicron,negative
89,2022-01-24 10:25:04+00:00,Beritasatu,1626 pasien omicron butuh tabung oksigen 20 pasien 2 pasien tinggal lengkap omicron,negative
90,2022-01-25 23:33:00+00:00,newsmerahputih,tingkat covid19 picu sebar varian omicron merahputihcom omicron covid19,negative
91,2022-01-25 17:16:04+00:00,Universo_AG,medicine 25jan2022 by universoag coronavirus covid19 pandemic omicron variant,negative
92,2022-01-25 15:15:03+00:00,jpnncom,warga karawang lapor papar varian omicron guru terima vaksin booster omicron,negative
93,2022-01-25 14:20:17+00:00,ABCHAMP11,lin omicron,negative
94,2022-01-25 13:19:52+00:00,lampungpost_,hari covid19 kota bandar lampung tambah tambah diiduga muncul aktivitas jalan covid19 covid covid19lampung omicron omicronvirus lampostco,negative
95,2022-01-25 13:14:26+00:00,bharianmy,bhdunia syarikat farmaseutikal gergasi jangka sedia fail kelulus regulator vaksin jelang mac omicron vaksin coronavirus covid19,negative
96,2022-01-25 13:02:17+00:00,fajaronline,omicron ganas jakarta capai 1697 covid19 jakarta omicron,negative
97,2022-01-25 13:00:14+00:00,arirangtvnews,virus concerns in korea analysis covid19 infection omicron arirang news news center,negative
98,2022-01-25 12:39:00+00:00,kbxx_x,beijing2022 wuhan virus is ready omicron,negative
99,2022-01-25 11:19:49+00:00,rmbantencom,21 warga banten apar omicron tangsel omicron tangsel humastangsel bidhumasbanten,negative
100,2022-01-25 11:03:24+00:00,bharianmy,bhnasional 7036 kes varian bimbang omicron coronavirus covid19,negative
101,2022-01-25 10:47:59+00:00,aewin86,4875 hari 2927 covid19 omicron,negative
102,2022-01-25 10:41:34+00:00,pikiran_rakyat,update covid19 indonesia 25 januari 2022 aktif tambah 3989 update pasien positif tinggal dunia sembuh perintah virus corona omicron delta covid19 indonesia prmn pikiranrakyat,negative
103,2022-01-25 10:13:02+00:00,majoritionline,kes covid19 majoriti primer ghz70307 covid19 omicron,negative
104,2022-01-25 08:57:22+00:00,AvengerX30,hairypoppins786 sukar ye nhi bola tum hi omicron ho tum hi corona ho,negative
105,2022-01-25 08:43:20+00:00,RezhaSulee,omicron dah tau aja ramadhan dateng indonesia omicron kampung indo omicronindonesia omicron covid19,negative
106,2022-01-25 08:42:23+00:00,OfficialiNewsTV,omicron tahan muka plastik kulit manusia banding varian lengkap inews covid19 corona jepang omicron delta alpha beta kedokteranprefekturkyoto,negative
107,2022-01-25 08:41:39+00:00,RezhaSulee,mayoritas muslim negara indonesia pikir lokdon aja gak pulang kampung akibat omicron omicronindonesia omicron covid19,negative
108,2022-01-25 08:39:40+00:00,RezhaSulee,puasa eh covid varian omicronindonesia omicron covid19,negative
109,2022-01-26 19:25:34+00:00,Beritabaruco,omicron ganas jakarta aktif tembus 12196 dkijakarta kasusaktifcovid19 kasusomicron omicron,negative
110,2022-01-26 19:02:21+00:00,arini_rizka,gubernur omicron jawa barat kendali covid delmicron florona omicron,negative
111,2022-01-26 17:18:03+00:00,inewsdotid,1922 warga dki papar omicron mayoritas laku jalan negeri omicron,negative
112,2022-01-26 16:26:17+00:00,mainmainid_,omicron indonesia jamur gejala waspada omicron coronaupdate coronaupdate omicronvariant,negative
113,2022-01-26 14:26:46+00:00,rmbantencom,siswa smpn 4 tangsel papar covid19 ajar jarak laku ptm covid19 omicron humastangsel,negative
114,2022-01-26 14:12:42+00:00,AdilFX37,drama hero tamil varian omicron gaisss jahanam omicron malaysia boosterdosekiller,negative
115,2022-01-26 13:41:21+00:00,JamiiForums,covid19 korea sin imerekodi maambukizi 13102 huku mamlaka zikionya kirusi cha corona aina omicron kinaweza kuchangia had 90 maambukizi mapya wiki zijazo ni mara kwanza visa zaidi 13000 kurekodiwa katika taifa hilo soma uviko3,negative
116,2022-01-26 13:16:02+00:00,terkinidotid,pesan bijak dr tirta tengah lonjak omicron indonesia covid19 varian omicron indonesia alami lonjak dokter influencer tirta mandira hudhi alias dr tirta saran pasien yang news drtirta omicron,negative
117,2022-01-26 13:07:49+00:00,aewin86,ribu jangkit omicron inggeris 23nya aku sintas covid19 varian,negative
118,2022-01-26 12:56:05+00:00,fajaronline,update covid19 tajam tambah 7010 covdi19 omicron updatecovid19,negative
119,2022-01-26 12:20:09+00:00,yudisudiyono,jabat mah bebas omicron puanmaharani puan ketuadpr rezimbudakoligarki,negative
120,2022-01-26 11:46:00+00:00,newsmerahputih,varian omicron nyata jawa barat hari covid19 tambah signifikan merahputihcom omicron update,negative
121,2022-01-26 11:21:53+00:00,danisdiy,gila hormat teng ngko dikiro ngece ngel wis covid19 omicron dpr,negative
122,2022-01-26 11:04:09+00:00,aewin86,lonjak 7010 daritadinya 4000an hari dki tembus 3509 hari covid19 omicron jagaprokes pakaimasker,negative
123,2022-01-26 09:59:09+00:00,monitorindo,gelar pesta ultah lockdown ketat bor johnson ancam mosi percaya borisjohnson mositidakpercaya pestaulangtahun covid19 lockdown omicron pminggris,negative
124,2022-01-27 23:32:00+00:00,newsmerahputih,libur natal tahun 20212022 klaim faktor sebab lonjak covid19 varian omicron jakarta merahputihcom omicron covid19,negative
125,2022-01-27 16:59:45+00:00,ahmed45231050,lanyakia cluster omicron,negative
126,2022-01-27 16:54:23+00:00,chatnews_id,satgas tangan covid19 sub varian omicron ba2 perhati covid19 omicron omicronba2,negative
127,2022-01-27 14:30:20+00:00,realAbikaTrader,mikir covid udah varian omicron varian delta kappa varian hilang,negative
128,2022-01-27 13:41:34+00:00,lampungpost_,hari covid19 lampung tambah hitung 2427 januari 2022 covid19 tambah 26 covid19 covid covid19 omicron omicronvirus lampostco,negative
129,2022-01-27 13:21:28+00:00,arini_rizka,waspada koreksi ancam ihsg peluang kuat batas covid delmicron florona omicron,negative
130,2022-01-27 13:18:03+00:00,jpnncom,menkes budi gunadi sadikin tingkat isi tidur rumah sakit omicron tingkat omicron,negative
131,2022-01-27 13:13:03+00:00,mainmainid_,ilmuwan identifikasi varian versi siluman omicron ba2 omicron coronadebat coronavirus covid19,negative
132,2022-01-27 12:59:44+00:00,PostMalaysia,tahap risiko kait varian omicron kekal tinggi who malam kes baharu covid19 cecah rekod tinggi minggu lepas,negative
133,2022-01-27 12:10:18+00:00,MNowNews,kes hari tinggi sember 2021 27 januari malaysianow news flashnews covid19 omicron,negative
134,2022-01-27 11:58:49+00:00,Beritasatu,tambah 222 omicron indonesia capai 1988 pasien baca lengkap,negative
135,2022-01-27 11:53:06+00:00,Beritabaruco,karyawan pabrik gresik infeksi omicron transmisi lokal covid19omicron gresik omicron pabrikdigresik,negative
136,2022-01-27 11:35:22+00:00,fajaronline,omicron indonesia tembus 1988 pesan menteri sehat budigunadisadikin menkes omicron updateomicron,negative
137,2022-01-27 11:33:02+00:00,jpnncom,menkes budi gunadi sadikin tinggal akibat varian omicron omicron,negative
138,2022-01-27 11:23:02+00:00,jpnncom,menkes budi gunadi sadikin konfirmasi varian omicron rabu 261 capai 1988 omicron,negative
139,2022-01-27 11:21:06+00:00,murianewscom,baru pasien omicron indonesia tinggal dunia lengkap klik taut jakarta pasien omicron tinggal,negative
140,2022-01-27 10:47:08+00:00,hadiRochman1972,om micron parah gawat inibisa2 gak yg izin mudik lebaran om micronemang bener rembet jateng merembetbisa gak micron nasehat yg om biar gk merembetkalo bandel jewer omicron,negative
141,2022-01-27 10:05:11+00:00,radar_malang,ditracing 15 warga kota malang positif covid19 dinkes pasti omicron dinkeskabmalang covid19 ppkm omicronvarient jatimpemprov news beritaterkini dprdmalangkota omicron,negative
142,2022-01-27 09:58:47+00:00,pikiran_rakyat,update covid19 indonesia 27 januari 2022 aktif tambah 6427 update pasien positif tinggal dunia sembuh perintah virus corona omicron delta covid19 indonesia prmn pikiranrakyat,negative
143,2022-01-28 22:35:00+00:00,kompascom,banding varian delta varian omicron milik gejala ringan berat beda gejala berat gantung parah omicron covid19 gejalaomicron suarakompas jernihkanharapan,negative
144,2022-01-28 22:15:00+00:00,AbanteNews,omicron nanganganak pa tunaynatabloidista abantenews franciscoduqueiii omicron,negative
145,2022-01-28 16:59:00+00:00,newsmerahputih,positif covid19 indonesia lonjak dorong transmisi lokal sebar varian omicron merahputihcom omicron update,negative
146,2022-01-28 15:00:12+00:00,AMUBAIDAHS,sangka omicron merbahaya amerika syarikat mati pasca vaksin,negative
147,2022-01-28 14:33:04+00:00,IndonesiaBaikId,presiden jokowi omicron msh trs lonjak dg covid19 yg alami tingkat perintah tlh siap yuk kencang sabuk kam amp waspada sohib indonesiabaik presidenindonesiamaju kominfonewsroom,negative
148,2022-01-28 13:29:43+00:00,infoJATIASIH,drastis aktif covid19 kotabekasi tembus 2000 pasien omicron,negative
149,2022-01-28 12:56:00+00:00,jpnncom,beritaterupdate omicron tingkat wagub dki isi tidur rs capai 45 persen omicron dkijakarta,negative
150,2022-01-28 12:52:19+00:00,DenpasarKota,sembuh 3 catat 1 pasien tinggal waspada warga kota taat protokol sehat ayo cepat vaksin denpasarkota kasusharian covid19 omicron waspada taatprokes,negative
151,2022-01-28 12:36:01+00:00,Ameta_Vikram,yar ab ye kya backchodi omicron neocov omicronvarient neocov,negative
152,2022-01-28 12:03:13+00:00,IDbelasting,tular lokal omicron jakarta dekat transmisi ppln omicron kasusomicron,negative
153,2022-01-28 11:46:27+00:00,lampungpost_,dinas sehat provinsi lampung konfirmasi positif covid19 varian omicron dasar periksa pcr metode gene target failure sgtf dinkeslampung covid19 covid omicron omicronlampung lampostco,negative
154,2022-01-28 11:12:00+00:00,newsmerahputih,muncul subvarian covid19 varian omicron nama ba2 perhati dunia merahputihcom omicron covid19,negative
155,2022-01-28 11:01:39+00:00,murianewscom,jokowi prediksi omicron lonjak hitung pekan lengkap klik taut jakarta prediksi presiden jokowi omicron,negative
156,2022-01-28 10:53:36+00:00,santridanalam,9905 sembuh 2028 tinggal 7 aktif 43574 7870 omicron indonesia covid19,negative
157,2022-01-28 10:08:13+00:00,buletinfm,buletinfmhighlights gaduh pedang tawau siti bainun benar pasport tingkat kes omicron tapak komuniti buletinfm tawau omicron oku viral sumber bharianmy,negative
158,2022-01-28 09:59:40+00:00,pikiran_rakyat,update covid19 indonesia 28 januari 2022 positif tambah 9905 update pasien positif tinggal dunia sembuh perintah virus corona omicron delta covid19 indonesia prmn pikiranrakyat,negative
159,2022-01-28 09:52:18+00:00,iamL0GAN,itni khushi corona delta omicron neocov,negative
160,2022-01-29 15:06:24+00:00,SaptaSahasrani,tembus 10k 11588 17 tinggal aktif lampau 50k 29 januari 52555 weekly case change 270 weekly death change 70 kumulatif minggu 38927 minggu 10508 covid19 omicron indonesia,negative
161,2022-01-29 14:40:32+00:00,fajaronline,11588 covid19 satgas idi anggap enteng covid19 idi omicron zubairi,negative
162,2022-01-29 14:23:00+00:00,NTriandana,barusan warga telpon bang gimana cucu yg tangerang hasil pcr positif kemarin ketemu paksa deh malam minggu wa an bu dokter puskesmas omicron,negative
163,2022-01-29 14:01:00+00:00,iskandarjet,pantes aja varian covid drastis thn omicron pas tahun tahun,negative
164,2022-01-29 13:05:06+00:00,infoPKU,barubaru warga pekanbaru konfirmasi positif covid19 varian omicron sumber infopku pekanbaru omicron,negative
165,2022-01-29 12:23:45+00:00,chatnews_id,uk health security agency ukhsa sebut tingkat tular tinggi ba2 banding ba1 wilayah inggris omicron2 omicron covid19,negative
166,2022-01-29 12:14:00+00:00,Inanewsindo,waspada varian omicron tembus 2 ribu sumber foto fotogalih pradipta omicronvarient omicron covid19,negative
167,2022-01-29 12:10:10+00:00,CBCDharmapuri,led mobile van publicity on covid19 and covidvaccine awareness by fob dharmapuri at udaiyapatty masinaickenpatty athikaripatty villages in salem district omicron mask covidwave robchennaimib pibchennai,negative
168,2022-01-29 09:36:37+00:00,ASaifaji,siswa dihimbau rumah menghimbau jalanjalan padang gimana cerita ni sekolah covid19 omicron anaksma,negative
