,date,username,Steaming,label
1108,2022-06-17 04:34:00+00:00,disway_id,panik covid ba4 ba5 ringan banding omicron delta simak jelas kemenkes mohammadsyahril omicron delta kemenkes vaksinasi covid19 kemenkesri klik,positive
1109,2022-06-17 03:32:30+00:00,IDbelasting,perintah pantau ketat gelombang varian omicron varianbaruomicron omicronba4danba5 covidnaiklagi,positive
1110,2022-06-16 03:35:24+00:00,sdc1000_id,share info temen lo segerindulucoy vitaminc vitc minumansehat dayatahantubuh imuntubuh sistemimunitastubuh cegahcovid covid19indonesia variancovid19 omicronba4 omicronba5 omicron suplemen madu prokes booster vaksin dayatahantubuhkuat,positive
1111,2022-06-15 12:27:51+00:00,IDbelasting,waspada subvarian omicron ba4 ba5 sebar cepat omicron waspadaomicron prokes,positive
1112,2022-06-15 09:30:06+00:00,prodia_women,ladies lengah ikut protokol sehat cintaidirimu omicron,positive
1113,2022-06-15 09:18:18+00:00,prodia_senior,senior lengah ikut protokol sehat kinihinggananti omicron,positive
1114,2022-06-15 09:17:25+00:00,prodia_health,sahabat prodia lengah ikut protokol sehat prodiahealthcare hidupsehatberkualitas letscheckup omicron,positive
1115,2022-06-15 09:15:48+00:00,prodia_children,moms n dads lengah ikut protokol sehat prodiachildren lindungimasadepannya letschekup omicron,positive
1116,2022-06-15 06:18:10+00:00,rsprotinsulu,4 jaga jarak jauh kerumun 5 vaksinasi covid19 lengkap 6 sirkulasi udara ruang segar sehat tetapjagaprokes protokolkesehatan varianbaru omicron covid19,positive
1117,2022-06-14 13:10:02+00:00,IDbelasting,satgas covid19 masyarakat terap pola hidup bersih covid19 omicron waspadaomicron omicronmeningkat,positive
1118,2022-06-14 08:07:03+00:00,pikiran_rakyat,kapuskes tni omicron ba 4 ba 5 bahaya masyarakat panik takut covid omicron ba4 ba5 prmn pikiranrakyatmedianetwork potensilokalgonasional kolaborasimediapreneurnusantara pikiranrakyat,positive
1119,2022-06-14 06:52:23+00:00,Brotogel1,selamat siang bro hasil putar angka sydney sd 4d3d2d 7957 shio kuda ucap selamat menang brotogel togelsydney omicron,positive
1120,2022-06-14 06:06:02+00:00,jpnncom,mayjen tni dr budiman jelas omicron subvarian ba4 ba5 masyarakat takut omicron,positive
1121,2022-06-14 05:55:09+00:00,mediapilarID,antisipasi subvarian omicron gubernur riau imbau masyarakat laku vaksinasi booster pilarid omicron,positive
1122,2022-06-14 04:24:51+00:00,alqudsamaanati,variant virus covid19 nih gaes yuk simak bahas singkat lini omicron covid19 coronavirusdisease,positive
1123,2022-06-14 02:36:02+00:00,murianewscom,masyarakat waspada subvarian omicron ba4 ba5 lengkap klik taut jakarta covid19 subvarianomicron omicron ba4 ba5,positive
1124,2022-06-14 01:46:31+00:00,natasya_puspa4,jokowi menteri waspada hatihati varian omicron ba4 ba5 indonesia nilai who kondisi pandemi covid19 omicron jokowi indonesia waspadacovid19 bts9thanniversary,positive
1125,2022-06-14 01:03:00+00:00,akusehatklinik,sobat sehat panik waspada yuk disiplin prokes laku vaksinasi ragu tes gejala sehat swabantigenbandung antigenbandung swabbandung testcovid omicron covid19,positive
1126,2022-06-13 23:35:57+00:00,nusabalicom,omicron ba4 ba5 temu bal kadinkes panik dinkesbali berita nusabali covid19 omicron kemenkes,positive
1127,2022-06-13 16:27:21+00:00,jatimterdepan,moga badai virus dii tengah geliat ekonomi covi d19 omicron ekonomi fyp fyp,positive
1128,2022-06-13 15:04:15+00:00,znufus994,sepi hp gak chet omicron,positive
1129,2022-06-13 14:26:41+00:00,golaliid,hindar varian omicron pesan dinkes kota bandung infobdg golalidotid golaliid omicron,positive
1130,2022-06-13 14:12:27+00:00,IsmiNurjanah14,subvarian omicron udh indonesia lgii mengsedihtpi yowis sbgai kaum rebah mending gue ngegame aja rmh aman ampdpt cuan ygy play follow boomtechvip topgun arcadebowlinggo2 boomtech omicron,positive
1131,2022-06-13 13:47:17+00:00,BROVEGAS4,hasil live draw taiwan result 3186 shio kerbau selamat menang jackpot brovegas resulttaiwan omicron,positive
1132,2022-06-13 10:55:06+00:00,IDbelasting,perintah wajib vaksin booster ramai omicron vaksinbooster waspadaomicron,positive
1133,2022-06-13 09:37:32+00:00,Satukata__,kenal si kembar omicron ba4 ba5 spostid omicron ba4 ba5 spostid,positive
1134,2022-06-13 03:31:18+00:00,polisilinggau_,vaksin 1 2 lupa booste covid covid19 corona omicron vaksin latepost,positive
1135,2022-06-13 02:27:37+00:00,lalaura_lau,masyarakat waspada varian covid19 omicron tular infeksi anak covid covid19 omicron varianbarucorona sehat,positive
1136,2022-06-13 01:04:04+00:00,tribunbalikanal,menparekraf masyarakat bal waspada kait subvarian omicron ba4 ba5 covid19,positive
1137,2022-06-12 09:38:40+00:00,chatnews_id,covid19 subvarian omicron ba4 ba5 ingat kuat protokol sehat,positive
1138,2022-06-11 10:29:05+00:00,wellylie99,asean airpollution trending who polusigedungperkantoran dkijakarta usa polusiapartemen iqair imf bi ispa kanker covid19 omicron g20 dosapltupln kawasan bintaro selatan jakarta sdh polusi hebat code red kasihan yaa guys pake masker yaa,positive
1139,2022-06-11 04:16:00+00:00,holopiscom,juru bicara menteri sehat mohammad syahril imbau masyarakat panik masuk subvarian ba4 ba5 mutasi varian omicron kemenkesri omicron,positive
1140,2022-06-11 03:28:00+00:00,sariagri_id,bacadulu juru bicara menteri sehat subvarian omicron ba4 ba5 sebab covid19 negara dunia sariagri faktaunik infounik informasi berita sehat covid omicron,positive
1141,2022-06-10 13:25:58+00:00,wellylie99,asean airpollution trending who polusigedungperkantoran dkijakarta usa polusiapartemen iqair imf bi ispa kanker covid19 omicron g20 dosapltupln polusi udara msh kendali tahan,positive
1142,2022-06-10 02:59:57+00:00,polisilinggau_,patuh perintah baik covid covid19 corona omicron vaksin latepost,positive
1143,2022-06-09 12:53:39+00:00,wellylie99,asean airpollution trending who polusigedungperkantoran dkijakarta usa polusiapartemen iqair imf bi ispa kanker covid19 omicron g20 dosapltupln polusi udara kumat,positive
1144,2022-06-09 04:05:44+00:00,wellylie99,asean airpollution trending who polusigedungperkantoran dkijakarta usa polusiapartemen iqair imf bi ispa kanker covid19 omicron g20 dosapltupln 10 jam udara level sehat payah performa si ibukota yaa,positive
1145,2022-06-08 13:39:24+00:00,wellylie99,asean airpollution trending who polusigedungperkantoran dkijakarta usa polusiapartemen iqair imf bi ispa kanker covid19 omicron g20 dosapltupln wadow polusi udara nyaa parah bingitz sihh,positive
1146,2022-06-05 12:42:23+00:00,wellylie99,asean airpollution trending who polusigedungperkantoran dkijakarta usa polusiapartemen iqair imf bi ispa kanker covid19 omicron g20 dosapltu ngeri polusi udara hari jakarta iya sih bencana bs dtg mah kaga lu org payah yaa,positive
1147,2022-06-03 03:34:36+00:00,polisilinggau_,fit jaga jarak lawan bicara jumpa covid covid19 corona omicron vaksin latepost,positive
1148,2022-06-02 03:54:06+00:00,polisilinggau_,hidup sehat covid covid19 corona omicron vaksin latepost,positive
1149,2022-05-31 04:28:32+00:00,polisilinggau_,patuh prokes covid covid19 corona omicron vaksin latepost,positive
1150,2022-05-30 05:36:40+00:00,polisilinggau_,matu protokol sehat covid covid19 corona omicron vaksin latepost,positive
1151,2022-05-30 00:45:59+00:00,LimzJenny,manfaat waktu menang rupiah dominoqq aduq bandarqonline pokeruangasli palapaqq judionline bandarceme pokerindonesia sakong bandarq depositpulsa ourmeissachanyeolday ptdonstagela mirafinalcheckpoint stageforarmy omicron,positive
1152,2022-05-29 06:02:47+00:00,polisilinggau_,cuci tangan aktivitas covid covid19 corona omicron vaksin latepost,positive
1153,2022-05-29 06:02:14+00:00,polisilinggau_,lena jaga sehat covid covid19 corona omicron vaksin latepost,positive
1154,2022-05-28 03:24:03+00:00,polisilinggau_,baik covid covid19 corona omicron vaksin latepost,positive
1155,2022-05-27 03:11:47+00:00,polisilinggau_,jaga sehat bestie covid covid19 corona omicron vaksin latepost,positive
1156,2022-05-26 02:08:32+00:00,Media_Rania,kat malaysia kes pekak ismailsabri60 china beijing omicron dapat barangan ayuhmalaysia,positive
1157,2022-05-24 13:21:02+00:00,wellylie99,asean airpollution trending who dkijakarta usa polusiapartemen iqair imf bi ispa kanker omicron g20 dosapltupln dosabni46 formulae sabar bentar natal gak asa eh uda 24 aja ganti bantu negara moga bawa ubah cek mandiri,positive
1158,2022-05-24 03:15:39+00:00,polisilinggau_,masker rumah ceritaserem covid19 omicron,positive
1159,2022-05-23 04:37:03+00:00,polisilinggau_,pakaimasker ruang tutup kondisi fisik fit covid covid19 corona omicron vaksin latepost,positive
1160,2022-05-21 07:05:10+00:00,MediakomKemkes,waspada varian omicron kilasinternasional variancovid,positive
1161,2022-05-21 03:19:37+00:00,polisilinggau_,covid19 landai ajur masker covid covid19 corona omicron vaksin latepost,positive
1162,2022-05-21 03:16:45+00:00,polisilinggau_,covid19 landai ajur masker covid covid19 corona omicron vaksin latepost,positive
1163,2022-05-19 15:14:51+00:00,MC_Nishidella98,info baru pandemi reda indonesia maju endemi lepas masker ruang covid19 omicron endemi kemenkesri malamjumat tgifthistomorrow,positive
1164,2022-05-17 01:21:22+00:00,MC_Nishidella98,aktif kurang waspada lonjak covid19 omicron subvarian ba4 ba5 hrs terap protokol sehat cuci tangan pakai masker jaga jarak hindar kerumun covid19 omicron omicronba4 omicronba5 kemenkesri satgascovid19,positive
1165,2022-05-16 05:05:17+00:00,polisilinggau_,patuh prokes covid19 covid covid19 corona omicron vaksin,positive
1166,2022-05-15 13:35:04+00:00,MC_Nishidella98,aktif covid19 tiongkok cepat turun kota kembang pesat cepat pulih covid19 omicron pemulihanekonomisecaranasional who kegiatanmasyarakat weekend,positive
1167,2022-05-15 06:13:25+00:00,MC_Nishidella98,bln dpn wajib prokes rencana covid19 omicron covid19 omicron bahaya wajibprotokolkesehatan kemenkesri weekend,positive
1168,2022-05-11 11:36:28+00:00,iloveaceh,moga omicron tambah ribu,positive
1169,2022-05-11 09:38:14+00:00,MSufianAnwer,yad tou ati ho gi meri omicron,positive
1170,2022-05-11 03:58:00+00:00,polisilinggau_,pandemi patuh prokes covid covid19 corona omicron vaksin latepost,positive
1171,2022-05-11 03:51:29+00:00,polisilinggau_,jaga bersih hindar sakit covid covid19 corona omicron vaksin latepost,positive
1172,2022-05-08 06:55:43+00:00,dikareza6,capai program vaksinasi nasional vaksincovid19 lebaran omicron covid19,positive
1173,2022-05-01 03:56:25+00:00,indrabustami,alhamdulillah pepaya burung pepaya bantu reda nyeri tenggorok batuk covid19 omicron,positive
1174,2022-04-29 03:07:49+00:00,TaufiqMarhaban,tim teliti china kembang vaksin covid19 bukti efektif lawan infeksi strain delta omicron dekat vaksin chimeric receptorbinding domain rbddimer,positive
1175,2022-04-28 07:38:58+00:00,liralali998,upaya perintah tingkat capai vaksinasi covid19 vaksincovid19 lebaran omicron covid19,positive
1176,2022-04-26 05:57:35+00:00,Albheart3,coronavirus kabar gak kabar kangen nih omicron sebentar aja sih singgah sakit kalo ditinggalin pas sayangsayangnya covid19 vaksinasibooster,positive
1177,2022-04-25 02:51:30+00:00,polisilinggau_,aktivitas luar lupa patuh prokes covid covid19 corona omicron vaksin latepost,positive
1178,2022-04-24 09:23:07+00:00,theSundaily,do rtkag test before kampung lantan mb thesun thesundaily health covid19 omicron mysj lantan,positive
1179,2022-04-22 18:09:52+00:00,wellylie99,asean airpollution trending who polusigedungperkantoran dkijakarta usa polusiapartemen iqair imf bi ispa kanker covid19 omicron g20 kasihan bener nasib warga jakarta kirim coba bkn org asing tp pemerimtaham apes,positive
1180,2022-04-22 04:54:38+00:00,polisilinggau_,sehat hindar sebar covid19 ayo vaksin mudik covid covid19 corona omicron vaksin latepost mudik2022,positive
1181,2022-04-22 04:43:32+00:00,polisilinggau_,vaksinasi serentak man 1 lubuklinggau covid covid19 corona omicron vaksin latepost,positive
1182,2022-04-21 06:30:34+00:00,liralali998,komitmen perintah arus mudik lebaran tahun 2022 vaksincovid19 lebaran omicron covid19,positive
1183,2022-04-21 06:30:24+00:00,liralali998,komitmen perintah arus mudik lebaran tahun 2022 vaksincovid19 lebaran omicron covid19,positive
1184,2022-04-21 06:30:20+00:00,liralali998,komitmen perintah arus mudik lebaran tahun 2022 vaksincovid19 lebaran omicron covid19,positive
1185,2022-04-21 06:30:15+00:00,liralali998,komitmen perintah arus mudik lebaran tahun 2022 vaksincovid19 lebaran omicron covid19,positive
1186,2022-04-21 06:25:33+00:00,dikareza6,komitmen perintah arus mudik lebaran tahun 2022 vaksincovid19 lebaran omicron covid19,positive
1187,2022-04-21 06:25:28+00:00,dikareza6,komitmen perintah arus mudik lebaran tahun 2022 vaksincovid19 lebaran omicron covid19,positive
1188,2022-04-21 06:25:23+00:00,dikareza6,komitmen perintah arus mudik lebaran tahun 2022 vaksincovid19 lebaran omicron covid19,positive
1189,2022-04-21 06:25:18+00:00,dikareza6,komitmen perintah arus mudik lebaran tahun 2022 vaksincovid19 lebaran omicron covid19,positive
1190,2022-04-21 04:22:00+00:00,polisilinggau_,cegah covid covid19 corona omicron vaksin latepost,positive
1191,2022-04-20 09:13:57+00:00,liralali998,himbauan masyarakat ikut program vaksinasi covid19 lebaran tahun 2022 vaksincovid19 lebaran omicron covid19,positive
1192,2022-04-20 02:04:57+00:00,ThePhraseID,sepele simak gejala omicron anak thephraseid omicron covid19 pandemi corona,positive
1193,2022-04-18 13:44:08+00:00,Media_Rania,kes jangkit omicron turun ada berbaloi southkorea omicron,positive
1194,2022-04-16 07:08:03+00:00,dikareza6,upaya perintah jaga tren turun covid19 vaksincovid19 turun ppkm omicron covid19,positive
1195,2022-04-16 07:07:58+00:00,dikareza6,upaya perintah jaga tren turun covid19 vaksincovid19 turun ppkm omicron covid19,positive
1196,2022-04-16 07:07:52+00:00,dikareza6,upaya perintah jaga tren turun covid19 vaksincovid19 turun ppkm omicron covid19,positive
1197,2022-04-16 07:07:47+00:00,dikareza6,upaya perintah jaga tren turun covid19 vaksincovid19 turun ppkm omicron covid19,positive
1198,2022-04-15 15:11:45+00:00,rmoljateng,korea selatan cabut batas sosial kait turun omicron klikrmol,positive
1199,2022-04-14 09:34:46+00:00,medisgratis,yuk samasama tingkat peduli saudarasaudara lupa panjat doa tulus sehat aamiin medisgratis konsultasikesehatangratis obatgratis layanankesehatangratis omicron covid19,positive
1200,2022-04-13 02:49:22+00:00,polisilinggau_,sebentar mudik nih lupa vaksin covid covid19 corona omicron vaksin latepost,positive
1201,2022-04-12 03:19:56+00:00,disway_id,shanghai buka prof liang sesat omicron anggap flu klik omicron shanghai covid19,positive
1202,2022-04-12 02:36:12+00:00,pg_ngadiredjo,haisobatperkebunan ingat istilah 5m 5m kunci tahan survive pandemi yuk review 5m bumnuntukindonesia akhlakbumn 10bisa sepuluhbisa covid omicron health prokes ptpnx,positive
1203,2022-04-11 03:24:30+00:00,Rsiakartika_sby,perhati tua waspada bahaya covid19 varian omicron infeksi anakanak tingkat tinggi omicron balita infeksi,positive
1204,2022-04-11 02:39:41+00:00,medisgratis,yuk samasama tingkat peduli saudarasaudara lupa panjat doa tulus sehat aamiin medisgratis konsultasikesehatangratis obatgratis layanankesehatangratis omicron covid19,positive
1205,2022-04-10 01:53:02+00:00,polisilinggau_,ayo vaksin mudik biar bawa sakit kampung halaman covid covid19 corona omicron vaksin latepost,positive
1206,2022-04-08 13:22:36+00:00,naga888_,alhamdulillah who bawa kabar covid tuh covid19 jakarta indonesia sebar virus omicron delta antigen swab pcr wabah pandemi rumahsakit isoman,positive
1207,2022-04-08 10:10:38+00:00,_rakyatmerdeka,update data kembang virus corona covid19 8 april 2022 omicron omicronvirus omicronvariant corona coronavirus covid19 covid rakyatmerdeka rmid,positive
1208,2022-04-08 03:13:33+00:00,MNowNews,kaji aplikasi telefon pintar dapat bahawa sakit omicron mungkin hilang dia bau banding sakit delta malaysianow mnow mnownews malaysia omicron delta covid,positive
1209,2022-04-08 01:01:42+00:00,bharianmy,bhdunia kaji bukti kesan dos galak coronavirus vaksin omicron coronavirus covid19,positive
1210,2022-04-07 11:03:03+00:00,_rakyatmerdeka,update data kembang virus corona covid19 7 april 2022 omicron omicronvirus omicronvariant corona coronavirus covid19 covid rakyatmerdeka rmid,positive
1211,2022-04-06 14:52:43+00:00,JaPenWPKL,kempen putus rantai covid19 keluarga malaysia iow komunikasikita keluargamalaysia reopeningsafely omicron lindungdirilindungsemua kitajagakita kitamestimenang menangbersama covid19 coronavirus klceria cmswpkl,positive
1212,2022-04-06 13:30:11+00:00,AnIntrovert_in,puri duniya ko hi saaf krne ka iraada kya omicron be,positive
1213,2022-04-06 13:21:52+00:00,JaPenWPKL,kempen putus rantai covid19 kempen derma darah iow komunikasikita omicron dermadarahselamatkannyawa lindungdirilindungsemua kitajagakita kitamestimenang menangbersama covid19 coronavirus klceria cmswpkl,positive
1214,2022-04-06 10:11:23+00:00,_rakyatmerdeka,update data kembang virus corona covid19 6 april 2022 omicron omicronvirus omicronvariant corona coronavirus covid19 covid rakyatmerdeka rmid,positive
1215,2022-04-05 15:30:00+00:00,matamilenialID,tumbuh ekonomi ri bangkit ganggu omicron baca lengkap mataindonesia ekonomi indonesia omicron,positive
1216,2022-04-05 14:40:00+00:00,Satukata__,wiku varian omicron xe deteksi indonesia spostid spostid omicron,positive
1217,2022-04-05 09:39:02+00:00,medisgratis,yuk samasama tingkat peduli saudarasaudara lupa panjat doa tulus sehat aamiin medisgratis konsultasikesehatangratis obatgratis layanankesehatangratis omicron covid19,positive
1218,2022-04-04 15:28:52+00:00,JaPenWPKL,fokus sampai maklumat fasa alih endemik langkahlangkah lindung varian omicron penting dos galak vaksin covid19 tri nilai kendiri covid19 kempen putus rantai covid19 iow komunikasikita omicron tri,positive
1219,2022-04-04 15:20:11+00:00,JaPenWPKL,kempen putus rantai covid19 iow komunikasikita omicron tri lindungdirilindungsemua kitajagakita kitamestimenang menangbersama covid19 coronavirus klceria cmswpkl,positive
1220,2022-04-04 15:05:01+00:00,JaPenWPKL,keluarga malaysia iow komunikasikita omicron keluargamalaysia lindungdirilindungsemua kitajagakita covid19 coronavirus klceria cmswpkl,positive
1221,2022-04-04 14:01:09+00:00,JaPenWPKL,fokus sampai maklumat fasa alih endemik nasihat kesihatan kkm langkahlangkah lindung varian omicron kempen putus rantai covid19 keluarga malaysia iow komunikasikita omicron keluargamalaysia,positive
1222,2022-04-04 13:34:00+00:00,JaPenWPKL,keluarga malaysia kempen derma darah iow komunikasikita omicron tri keluargamalaysia dermadarahselamatkannyawa lindungdirilindungsemua kitajagakita covid19 coronavirus klceria cmswpkl,positive
1223,2022-04-04 13:19:43+00:00,JaPenWPKL,tri nilai kendiri covid19 kempen putus rantai covid19 iow komunikasikita omicron tri lindungdirilindungsemua kitajagakita kitamestimenang menangbersama covid19 coronavirus klceria cmswpkl,positive
1224,2022-04-04 13:04:31+00:00,JaPenWPKL,kempen putus rantai covid19 keluarga malaysia iow komunikasikita omicron tri keluargamalaysia dermadarahselamatkannyawa lindungdirilindungsemua kitajagakita covid19 coronavirus klceria cmswpkl,positive
1225,2022-04-04 07:32:52+00:00,RunningTextID,kemenkes varian omicron xe temu indonesia kemenkes omicron nasional,positive
1226,2022-04-02 23:08:19+00:00,JaPenWPKL,tri nilai kendiri covid19 kempen putus rantai covid19 edar risalah keluarga malaysia sejahtera negara buku padu pelbagai buku lagu negara buku bendera negeri wilayah iow komunikasikita omicron tri,positive
1227,2022-04-02 03:51:11+00:00,polisilinggau_,vaksinasi bantu jaga kebal tubuh virus covid19 covid covid19 corona omicron vaksin latepost,positive
1228,2022-04-02 01:25:14+00:00,JaPenWPKL,fokus sampai maklumat fasa alih endemik nasihat kesihatan kkm langkahlangkah lindung varian omicron kempen putus rantai covid19 keluarga malaysia iow komunikasikita omicron keluargamalaysia,positive
1229,2022-04-01 05:47:45+00:00,polisilinggau_,waspada omicron patuh protokol sehat covid19,positive
1230,2022-04-01 05:26:02+00:00,medisgratis,yuk samasama tingkat peduli saudarasaudara lupa panjat doa tulus sehat aamiin medisgratis konsultasikesehatangratis obatgratis layanankesehatangratis omicron covid19,positive
1231,2022-03-31 16:02:17+00:00,JaPenWPKL,kempen putus rantai covid19 keluarga malaysia iow komunikasikita omicron tri keluargamalaysia lindungdirilindungsemua kitajagakita covid19 coronavirus klceria cmswpkl,positive
1232,2022-03-31 14:06:45+00:00,JaPenWPKL,kempen putus rantai covid19 iow komunikasikita omicron tri lindungdirilindungsemua kitajagakita kitamestimenang menangbersama covid19 coronavirus klceria cmswpkl,positive
1233,2022-03-31 13:29:43+00:00,JaPenWPKL,keluarga malaysia iow komunikasikita omicron tri keluargamalaysia lindungdirilindungsemua kitajagakita covid19 coronavirus klceria cmswpkl,positive
1234,2022-03-31 12:59:00+00:00,JaPenWPKL,penting dos galak vaksin covid19 tri nilai kendiri covid19 kempen putus rantai covid19 iow komunikasikita omicron tri lindungdirilindungsemua kitajagakita kitamestimenang menangbersama covid19 coronavirus klceria cmswpkl,positive
1235,2022-03-30 14:52:43+00:00,JaPenWPKL,kempen putus rantai covid19 kempen derma darah iow komunikasikita omicron tri dermadarahselamatkannyawa lindungdirilindungsemua kitajagakita kitamestimenang menangbersama covid19 coronavirus klceria cmswpkl,positive
1236,2022-03-30 14:06:32+00:00,JaPenWPKL,kempen derma darah iow komunikasikita omicron tri lindungdirilindungsemua kitajagakita kitamestimenang menangbersama covid19 coronavirus klceria cmswpkl,positive
1237,2022-03-30 11:53:09+00:00,pmisurakarta,temanteman konfirmasi positif covid19 khawatir perintah buka layan telekonsultasi obat gratis akses layan mari simak informasi covid19 omicron pmiselalubantu pmisolo,positive
1238,2022-03-30 04:35:57+00:00,matamilenialID,mitigasi cegah sebar varian omicron ri flash news nonton lengkap mataindonesia ppkm omicron beritaterkini,positive
1239,2022-03-29 23:26:03+00:00,JaPenWPKL,kempen putus rantai covid19 iow komunikasikita omicron tri lindungdirilindungsemua kitajagakita kitamestimenang menangbersama covid19 coronavirus klceria cmswpkl,positive
1240,2022-03-29 22:43:43+00:00,JaPenWPKL,keluarga malaysia iow komunikasikita omicron tri keluargamalaysia lindungdirilindungsemua kitajagakita covid19 coronavirus klceria cmswpkl,positive
1241,2022-03-29 22:32:16+00:00,JaPenWPKL,fokus sampai maklumat fasa alih endemik nasihat kesihatan kkm langkahlangkah lindung varian omicron kempen putus rantai covid19 keluarga malaysia iow komunikasikita omicron keluargamalaysia,positive
1242,2022-03-29 21:04:34+00:00,JaPenWPKL,keluarga malaysia iow komunikasikita omicron tri keluargamalaysia lindungdirilindungsemua kitajagakita covid19 coronavirus klceria cmswpkl,positive
1243,2022-03-29 12:19:09+00:00,JaPenWPKL,tri nilai kendiri covid19 kempen putus rantai covid19 keluarga malaysia iow komunikasikita omicron tri keluargamalaysia lindungdirilindungsemua kitajagakita covid19 coronavirus klceria cmswpkl,positive
1244,2022-03-29 12:05:15+00:00,JaPenWPKL,fokus sampai maklumat fasa alih endemik langkahlangkah lindung varian omicron penting dos galak vaksin covid19 tri nilai kendiri covid19 kempen putus rantai covid19 iow komunikasikita omicron tri,positive
1245,2022-03-29 11:47:16+00:00,syawal,simpletoned eddydaud pendemic tamat malaysia reda sbb ramai dpt vaksinasi gelombang terus tiada variant bahaya spt delta cepat rebak spt omicron langgar endemic zero mati hospitalisation,positive
1246,2022-03-29 08:00:00+00:00,ThePhraseID,pedulilindungi tahu check in pedulilindungi kuota internet cek yuk thephraseid pedulilindungi internet covid omicron,positive
1247,2022-03-29 05:08:32+00:00,polisilinggau_,sambut suci ramadhan sehat bugar khusyuk patuh protokol sehat covid19 covid covid19 corona omicron vaksin latepost,positive
1248,2022-03-29 04:54:05+00:00,jayabet_online,hasil live draw cambodia 29 maret 2022 result 6423 shio naga selamat menang jackpot jayabet keluarantogel omicron,positive
1249,2022-03-28 21:40:03+00:00,jpnncom,laku cepat proses sembuh infeksi varian omicron hidrasi omicron,positive
1250,2022-03-28 05:10:32+00:00,edwinubod,test syukur negatif covid19 omicron palispalis,positive
1251,2022-03-28 04:59:15+00:00,wartakotalive,7948 aktif covid19 jakarta minggu 27 maret waspada omicron wartakotalive omicron,positive
1252,2022-03-28 01:14:54+00:00,polisilinggau_,langkahlangkah kkta cegah sebar virus covid19 covid covid19 corona omicron vaksin latepost,positive
1253,2022-03-27 13:56:34+00:00,Beritabaruco,vaksin eksperimental sk bioscience tunjuk harap kait omicron omicron teliti skbioscience vaksincovid19,positive
1254,2022-03-27 12:07:50+00:00,JaPenWPKL,nasihat kesihatan kkm langkahlangkah lindung varian omicron penting dos galak vaksin covid19 tri nilai kendiri covid19 kempen putus rantai covid19 iow komunikasikita tiadaaedestiadadenggi omicron tri,positive
1255,2022-03-27 02:46:16+00:00,drkalai61,kaji icrnih gelombang delta kesan rendah 2 dos vaskin sinovac ikut kaji hkumed hong kong dos galak pfizer sinovac lindung tinggi gelombang omicron,positive
1256,2022-03-26 11:43:09+00:00,JaPenWPKL,langkahlangkah lindung varian omicron penting dos galak vaksin covid19 tri nilai kendiri covid19 kempen putus rantai covid19 iow komunikasikita tiadaaedestiadadenggi omicron tri,positive
1257,2022-03-25 13:48:36+00:00,JaPenWPKL,langkahlangkah lindung varian omicron penting dos galak vaksin covid19 tri nilai kendiri covid19 kempen putus rantai covid19 iow komunikasikita tiadaaedestiadadenggi omicron tri,positive
1258,2022-03-25 11:00:23+00:00,indonesia_ntd,tren omicron tiongkok beda negaranegara omicron wabah covid vaksin,positive
1259,2022-03-25 07:51:10+00:00,RunningTextID,omicron sebar 32 provinsi kecuali papua barat malu omicron covid19 nasional,positive
